Chunk Number,Original Text Chunk,Summary
153,series is more similar. f(x) maps to f(x) only when (j - i) is within fixed range databricks EBOOK: BIG BOOK OF MACHINE LEARNING USE CASES 2ND EDITION 22,Chunk 153: The following table lists the most popular books published in the UK
154,"Sound pattern matching Below are visualizations using matplotlib of the four audio clips: Traditionally, dynamic time warping is applied to audio clips to determine the Clip 1: This is our base time series based on the quote ""Doors and corners, similarity of those clips. For our example, we will use four different audio clips","Chunk 154: In this lesson, we will use dynamic time warping to determine the time series of sound clips."
155,"kid. That's where they get you."" based on two different quotes from a TV show called The Expanse. There are four audio clips (you can listen to them below, but this is not necessary) = three of Clip 2: This is a new time series [v2] based on clip 1 where the intonation and them (clips 1, 2 and 4) are based on the quote",Chunk 155: This is a new time series where the intonation and the words are based on the quote:
156,"speech pattern are extremely exaggerated Clip 3: This is another time series that's based on the quote ""You walk into a ""Doors and corners, kid. That's where they get you."" room too fast, the room eats you."" with the same intonation and speed as clip 1 And in one clip (clip 3) is the quote","Chunk 156: This time series is based on the quote ""Doors and corners, kid."""
157,"Clip 4: This is a new time series [v3] based on clip 1 where the intonation and speech pattern is similar to clip 1 ""You walk into a room too fast, the room eats you."" Clip1 Doors and corners, kid. Clip 2 Doors and",Chunk 157: This is a new time series based on clip 1 where the intonation and speech pattern is similar to clip
158,"kid. 1 corners, Clip1 Doors and corners, kid. Clip 2 Doors and corners, kid.","Chunk 158: Clip 1 Doors and corners, Clip 2 Doors and"
159,That's where they get you. M] That's where they get you. [v2] That's where they get you. [v] That's where they get you. [v2] 0:00/0:06,Chunk 159: Match of the Day presenter Gary Lineker explains why
160,"4 : 0:00/0:08 4) : Clip 3 You walk into a room too fast, Clip 4 Doors and corners, kid.","Chunk 160: Watch the latest news headlines from BBC News, including"
161,the room eats you. That's where they get you. [v3] 0:00/0:07 4) : 0:00/0:07,Chunk 161: In this week's episode of The One Show
162,": Clip 3 You walk into a room too fast, Clip 4 Doors and corners, kid. the room eats you. That's where they get you. [v3]",Chunk 162: Watch the video to find out what happens when you walk
163,"Quotes are from ""The Expanse"" databricks EBOOK: BIG BOOK OF MACHINE LEARNING USE CASES 2ND EDITION 23 The code to read these audio clips and visualize them using Matplotlib can be",Chunk 163: BBC News takes a look back at some of the most memorable quotes
164,"As noted below, the two clips (in this case, clips 1 and 4) have different intonations summarized in the following code snippet. (amplitude) and latencies for the same quote. from scipy.io import wavfile from matplotlib import pyplot as plt",Chunk 164: The following code snippet shows how to import a .wav file from matplotlib
165,"from mat tplotlib.pyplot import figure # Read stored audio files for comparison fs, data = wavile.read(""/dbfs/Eolder/clipl.wav"") # Set plot style plt.style.use Cseabora-whitegria?",Chunk 165: How do I set the plot style of a Matlab
166,"# Create subplots ax plt.subplot (2, 2, 1) ax.plot (datal, color-/#67A0DA) # Display created figure fig-plt.show ()",Chunk 166: # Create subplots ax plt.sub
167,"Doors and corners, kid. That's where they get you. display (fig) The full code base can be found in the notebook Dynamic Time Warping Background. databricks",Chunk 167: If you've ever wondered what it's like
168,"EBOOK: BIG BOOK OF MACHINE LEARNING USE CASES 2ND EDITION 24 If we were to follow a traditional Euclidean matching (per the following graph), even With dynamic time warping, we can shift time to allow for a time series comparison if we were to discount the amplitudes, the timings between the original clip (blue) between these two clips.",Chunk 168: This is an example of a time series that is dynamic.
169,and the new clip (yellow) do not match. EUCLIDEAN MATCHING DYNAMIC TIME WARPING corners' that's,Chunk 169: Match of the Day presenter Gary Lineker has criticised
170,"kid where they where, they doors and doors","Chunk 170: All photographs courtesy of AFP, EPA, Getty Images"
171,kid corners get and that's,Chunk 171: BBC Sport takes a look at some of the best
172,get you you databricks EBOOK: BIG BOOK OF MACHINE LEARNING USE CASES 2ND EDITION,Chunk 172: BBC News NI takes a look at some of the
173,"25 For our time series comparison, we will use the fastdtw PyPi library; the 20000 instructions to install PyPi libraries within your Databricks workspace can be found here: Azure IAWS. By using fastdtw, we can quickly calculate the distance between","Chunk 173: In this week's Databricks, we compare the performance of two of the most"
174,15000 the different time series. 10000 5000 from fastdtw import fastdtw,Chunk 174: The fastest car in the world at the moment.
175,"# Distance between clip 1 and clip 2 distance = fastdtw (data_clipl, data_clip2) [0] -5000 print (""The distance between the two clips is 8s"" 8 distance) -10000",Chunk 175: BBC News takes a look at some of the key statistics
176,-15000 50000 100000 150000 200000 250000 300000 350000 400000 450000 The full code base can be found in the notebook Dynamic Time Warping Background. Some quick observations: BASE,"Chunk 176: In our series of letters from African journalists, novelist and writer"
177,QUERY DISTANCE Clip 1 Clip 2 480148446.0,Chunk 177: Watch the highlights of Wales' Six Nations victory over
178,"As noted in the preceding graph, clips 1 and 4 have the shortest distance, as the audio clips have the same words and intonations Clip 3 310038909.0 The distance between clips 1 and 3 is also quite short",Chunk 178: The distance between the words in this clip and the words in the audio clip is shown
179,"longer Clip 4 293547478.0 (though than when compared to clip 4) = even though they have different words,",Chunk 179: BBC Newsnight takes a look at some of the
180,"they are using the same intonation and speed Clips 1 and 2 have the longest distance due to the extremely exaggerated intonation and speed even though they are using the same quote As you can see, with dynamic time warping, one can ascertain the similarity of two different time series.",Chunk 180: This is a clip of two different time series being played at the same time.
181,"Next Now that we have discussed dynamic time warping, let's apply this use case to detect sales trends. databricks EBOOK: BIG BOOK OF MACHINE LEARNING USE CASES 2ND EDITION","Chunk 181: In our series of letters from African journalists, novelist and writer"
182,26 CHAPTER 4: Using Dynamic Time Background Warping and MLflow to,Chunk 182: Researchers at the Massachusetts Institute of Technology (MIT)
183,"Imagine that you own a company that creates 3D printed products. Last year, you knew that drone Detect Sales Trends propellers were showing very consistent demand, SO you produced and sold those, and the year before you sold phone cases. The new year is arriving very soon, and you're sitting down with your manufacturing team Part 2 of our Using Dynamic Time Warping",Chunk 183: How do you keep track of demand for your products?
184,"to figure out what your company should produce for next year. Buying the 3D printers for your warehouse and MLflow to Detect Sales Trends series put you deep into debt, SO you have to make sure that your printers are running at or near 100% capacity at all times in order to make the payments on them. Since you're a wise CEO, you know that your production capacity over the next year will ebb and flow -","Chunk 184: If you're the CEO of a 3D printing company, you've probably been doing one of these things:"
185,"there will be some weeks when your production capacity is higher than others. For example, your capacity might be higher during the summer (when you hire seasonal workers), and lower during the third week of every month (because of issues with the 3D printer filament supply chain). Take a look at the chart below to see your company's production capacity estimate: By Ricardo Portilla, Brenner Heintz",Chunk 185: How do you know when your company's production capacity is high or low?
186,and Denny Lee Optimal Weekly Product Sales 35 30 Try this notebook series,"Chunk 186: All photographs courtesy of AFP, EPA, Getty Images"
187,25 (in DBC format) in Databricks * 20 I 15,Chunk 187: BBC Sport takes a look at some of the best
188,10 10 20 30 40,Chunk 188: BBC Sport takes a look back at some of the
189,50 Week databricks EBOOK: BIG BOOK OF MACHINE LEARNIN G USE CASES 2ND EDITION 27,Chunk 189: BBC News NI takes a look at some of the
190,"Your job is to choose a product for which weekly demand meets your production capacity as closely as possible. You're looking over a catalog of products which includes last year's sales numbers for each product, and you think this year's sales will be similar. If you choose a product with weekly demand that exceeds your production capacity, then you'll have to cancel customer orders, which isn't good for business. On the other hand, if you choose a product without",Chunk 190: How do you choose the best product for your business?
191,"enough weekly demand, you won't be able to keep your printers running at full capacity and may fail to make the debt payments. Dynamic time warping comes into play here because sometimes supply and demand for the product you choose will be slightly out of sync. There will be some weeks when you simply don't have enough capacity to meet all of your demand, but as long as you're very close and you can make up for it by producing","Chunk 191: If you're in the printing business, you'll know that if you don't make enough money, you won't be able to pay off your debts."
192,"more products in the week or two before or after, your customers won't mind. If we limited ourselves to comparing the sales data with our production capacity using Euclidean matching, we might choose a product that didn't account for this and leave money on the table. Instead, we'll use dynamic time warping to choose the product that's right for your company this year. databricks","Chunk 192: With databricks, we're taking the guess work out of product selection."
193,EBOOK: BIG BOOK OF MACHINE LEARNING USE CASES 2ND EDITION 28 Load the product sales data set Calculate distance to optimal time series by product code We will use the weekly sales transaction data set found in the UCI Data Set,Chunk 193: How do you measure the performance of your business?
194,"# Calculate distance via dynamic time warping between product code and Repository to perform our sales-based time series analysis. (Source attribution: optimal time series import numpy as np James Tan, emestanscsussedusg Singapore University of Social Sciences)",Chunk 194: This paper describes the use of time series import to perform our sales-based time
195,"import ucrdtw def get_ keyed_values (s) : import pandas as pd return (s[01, s[1:1) # Use Pandas to read this data",Chunk 195: import pandas as pd return : import pandas
196,"def compute.distance (row) : sales_pdf - pd.read_csv (sales_dbfspath, header=': infer') return (row [0], ucrdtw.ucrdtw (list (row [1J[0:521), list (optimal pattern), 0.05, True) [1]) # Review data",Chunk 196: Returns the distance between two points on a row in a
197,"display spark.createatarame (sales_pdf)) ts_values = pd.DataFrame (np. apply_along_axis (get.keyed.values, 1, sales.paf.values)) distances = pd.DataFrame (ap.apply_along.axis (compute.distance, 1, ts Product_Code V wo W1 W2 W3 W4 W5 W6 W7 W8 W9 W10 V W11 W12 W13",Chunk 197: Product_Code V wo W1 W2 W3 W4 W5
198,"values.values) distances.columns = 'dtw_dist'l ['pcode', P1 11 12 10",Chunk 198: The distance between two points on the Earth's
199,13 12 14 21 14 11 14 16 9 P2 7 o 3 2,Chunk 199: BBC Sport takes a look back at some of the
200,P3 7 11 10 13 12 14,Chunk 200: BBC Sport takes a look back at some of the
201,"P4 12 8 13 13 13 Using the calculated dynamic time warping ""distances"" column, we can view the P5",Chunk 201: The distances between the planets in the solar system are
202,8 5 13 11 14 11 18 distribution of DTW distances in a P6,Chunk 202: BBC Sport takes a look at some of the key
203,3 3 2 7 6 3 6 6 5 histogram. P7,Chunk 203: BBC Sport takes a look back at some of the
204,8 3 8 3 10 2 3 P8,Chunk 204: The winning numbers in Saturday evening's drawing of
205,8 10 10 0 15 0,Chunk 205: BBC Sport takes a look back at some of the
206,"DTW Distances for Each Pairwise Product Sales Comparison 30 70 60 Each product is represented by a row, and each week in the year is represented",Chunk 206: The following table shows the year-on-year sales
207,50 by a column. Values represent the number of units of each product sold per week. 40 30 There are 811 products in the data set.,Chunk 207: The following table lists the most popular food and drink products
208,20 10 10 Distances databricks,Chunk 208: BBC Sport takes a look at some of the best
209,"EBOOK: BIG BOOK OF MACHINE LEARNING USE CASES 2ND EDITION 29 From there, we can identify the product codes closest to the optimal sales trend After running this query, along with the corresponding query for the product codes (i.e., those that have the smallest calculated DTW distance). Since we're using","Chunk 209: Here's how it works: First, we run a query on the name of the product."
210,"that are furthest from the optimal sales trend, we were able to identify the two Databricks, we can easily make this selection using a SQL query. Let's display those products that are closest and furthest from the trend. Let's plot both of those that are closest. products and see how they differ. 8sql",Chunk 210: In this article we are going to look at two products that are closest to the optimal sales trend.
211,"Top 10 product codes closest to the optimal sales trend Comparing Optimal Sales Trends With P675 and P716 select pcode, cast (dtw_ dist as float) as dtw_dist from distances order 35 Optimal Sales Trend by cast (dtw_dist as float) limit 10",Chunk 211: Top 10 product codes closest to the optimal sales trend
212,30 P716 P675 25 20 6.0 15,Chunk 212: The winning numbers in Saturday evening's drawing of
213,5.5 5.0 10 4.5 4.0,Chunk 213: BBC Sport takes a look back at some of the
214,6 3.5  3.0 10 20 30,Chunk 214:     
215,"2.5 2.0 1.5 1.00 As you can see, Product #675 (shown in the orange triangles) represents the",Chunk 215: The following table shows the average selling price of the
216,"- 0.50 0.00 best match to the optimal sales trend, although the absolute sales are",Chunk 216: Sales figures for the first three months of the year
217,P675 P703 weekly P358 P697 P816 P601 P674 P372 P476 P694 pcode lower than we'd like (we'll remedy that later). This result makes sense since we'd,Chunk 217: BBC Sport looks at the best and worst results from the
218,"expect the product with the closest DTW distance to have peaks and valleys that somewhat mirror the metric we're comparing it to. (Of course, the exact time index for the product would vary on a week-by-week basis due to dynamic time warping.) Conversely, Product #716 (shown in the green stars) is the product with the worst match, showing almost no variability.",Chunk 218: This table shows the best- and worst-matched products against each other in terms of the time it takes for the sun to rise and set
219,"databricks EBOOK: BIG BOOK OF MACHINE LEARNING USE CASES 2ND EDITION 30 Finding the optimal product: Small DTW distance and Using MLflow to track best and worst products,",Chunk 219: Researchers at the Massachusetts Institute of Technology (MIT) are using
220,"similar absolute sales numbers along with artifacts Now that we've developed a list of products that are closest to our factory's MLflow is an open source platform for managing the machine learning lifecycle, projected output (our ""optimal sales trend""), we can filter them down to those that including experimentation, reproducibility and deployment. Databricks notebooks",Chunk 220: We've been looking at the products that are closest to our factory's machine learning needs.
221,"have small DTW distances as well as similar absolute sales numbers. One good offer a fully integrated MLflow environment, allowing you to create experiments, candidate would be Product #202, which has a DTW distance of 6.86 versus the log parameters and metrics, and save results. For more information about population median distance of 7.89 and tracks our optimal trend very closely.","Chunk 221: If you are looking for an easy-to-use machine learning (ML) environment for your product development, you might want to look at"
222,"getting started with MLflow, take a look at the excellent documentation. # Review P202 weekly sales MLflow's design is centered around the ability to log all of the inputs and y_p202 - sales_pdf Isales_pdf 'Product_ Code'] P202'1.values [0] [1:53] outputs of each experiment we do in a systematic, reproducible way. On every pass through the data, known as a ""run,"" we're able to log our experiment's:",Chunk 222: In this post I'm going to show you how to build a machine learning experiment using MLflow.
223,"Parameters: The inputs to our model Metrics: The output of our model, or measures of our model's success Comparing Optimal Sales Trends With Weekly Sales for P2 60 P716 Optimal Sales Trend Artifacts: Any files created by our model = for example, PNG plots or","Chunk 223: The following table lists the inputs to our model, or measures of our model's success:"
224,"50 CSV data output 40 Models: The model itself, which we can later reload and use to serve predictions",Chunk 224: Here's a look at some of the key
225,10 20 30 40 50,Chunk 225: BBC Sport takes a look back at some of the
226,"databricks EBOOK: BIG BOOK OF MACHINE LEARNING USE CASES 2ND EDITION 31 In our case, we can use it to run the dynamic time warping algorithm several times import mlflow","Chunk 226: In this paper, we show how we can use big data to"
227,"over our data while changing the ""stretch factor,"" the maximum amount of warp def run_ DTW (ts_stretch factor) : that can be applied to our time series data. To initiate an MLflow experiment, and # calculate DTW distance and Z-score for each product <strong>with mlflw.start_run () as run:</strong>","Chunk 227: To start an MLflow experiment, and # calculate DTW distance and Z-score for each product "
228,"allow for easy logging using mllow.log_param (), mllow.log.metrico. mllow.log.artifact (), and mlflow.log.model (), we wrap our main function # Log Model using Custom Flavor dtw_model = 'stretch_factor"" : float t.stretch.factor), using:",Chunk 228: In this post we are going to show you how to log into
229,"'pattern' : optimal pattern) <strongpmlflow cus om._lavor.log_model (dtw_model, artifact_ path= ""model"") </strong> iwith mllow.start_run () as run: # Log our stretch factor parameter to MLflow",Chunk 229: strongpmlflow cus om.
230,"trogallow.ogaran Catretch_factor"", ts.stretch._factor) </ strong> as shown in the abbreviated code at right. # Log the median DTW distance for this run StroNpIegte (""Median Distance"", distance._median) </",Chunk 230: The distance between the starting line and the finish line is
231,strong> # Log artifacts CSV file and PNG plot to MLflow <strongpmitow.logartifact/ascore.outliers + str (ts_stretch factor) + .csv') mllow.logartifact com.distMistogran png'),Chunk 231: # Log artifacts file and PNG plot strong
232,"return run.infoc/strong) stretch_ factors_ to_test = [0.0, 0.01, 0.025, 0.05, 0.1, 0.25, 0.5] for n in stretch facto S to_test: run_DTW (n) With each run through the data, we've created a log of the ""stretch factor""",Chunk 232: The BBC Sport website is running a series of tests to see if the BBC Sport
233,"parameter being used, and a log of products we classified as being outliers based upon the Z-score of the DTW distance metric. We were even able to save an artifact (file) of a histogram of the DTW distances. These experimental runs are saved locally on Databricks and remain accessible in the future if you decide to view the results of your experiment at a later date.",Chunk 233: In this paper we have used Databricks to store our experimental data on a local hard drive.
234,"databricks EBOOK: BIG BOOK OF MACHINE LEARNING USE CASES 2ND EDITION 32 Now that MLflow has saved the logs of each experiment, we can go back through reload models after they are initially constructed, as demonstrated in this","Chunk 234: In our series of letters from African journalists, film-maker and columnist Ahmed Rashid looks"
235,"and examine the results. From your Databricks notebook, select the ""Runs"" icon in blog post. For example, when using MLflow with scikit-learn, logging a model is the upper right-hand corner to view and compare the results of each of our runs. as easy as running the following code from within an experiment: wwwyoutubecom/watchpl-62PAPo-2ZU","Chunk 235: In this blog post, I'm going to show you how to run the following code from within an experiment."
236,"mlflow. sklearn.log.model (model=sk model, artifact path-sk_mode. ath"" Not surprisingly, as we increase our ""stretch factor,"" our distance metric decreases. MLflow also offers a ""Python function"" flavor, which allows you to save any Intuitively, this makes sense: as we give the algorithm more flexibility to warp the model from a third-party library (such as XGBoost or spaCy), or even a simple time indices forward or backward, it will find a closer fit for the data. In essence,",Chunk 236: MLflow is a Python-based machine learning algorithm that learns from large amounts of data.
237,"Python function itself, as an MLflow model. Models created using the Python we've traded some bias for variance. function flavor live within the same ecosystem and are able to interact with other MLflow tools through the Inference API. Although it's impossible to plan for every use case, the Python function model flavor was designed to be as universal and",Chunk 237: In this talk I'm going to show you how to use Python function as an MLflow model.
238,"Logging models in MLflow flexible as possible. It allows for custom processing and logic evaluation, which can come in handy for ETL applications. Even as more ""official"" model flavors MLflow has the ability to not only log experiment parameters, metrics and artifacts come online, the generic Python function flavor will still serve as an important",Chunk 238: MLflow is a Python-based tool for logging models in machine learning experiments.
239,"(like plots or CSV files), but also to log machine learning models. An MLflow model ""catchall,"" providing a bridge between Python code of any kind and MLflow's is simply a folder that is structured to conform to a consistent API, ensuring robust tracking toolkit. compatibility with other MLflow tools and features. This interoperability is very",Chunk 239: MLflow is a Python-based machine learning tool that can be used to track data from a variety of sources.
240,"powerful, allowing any Python model to be rapidly deployed to many different Logging a model using the Python function flavor is a straightforward process. types of production environments. Any model or function can be saved as a model, with one requirement: It must take in a pandas DataFrame as input, and return a DataFrame or NumPy",Chunk 240: Python Logging is a new feature in the Python programming language.
241,"MLflow comes pre-loaded with a number of common model ""flavors"" for many array. Once that requirement is met, saving your function as an MLflow model of the most popular machine learning libraries, including scikit-learn, Spark MLlib, involves defining a Python class that inherits from PythonModel, and overriding the PyTorch, TensorFlow, and others. These model flavors make it trivial to log and",Chunk 241: MLflow is a Python library for building machine learning models.
242,"-predict () method with your custom function, as described here. databricks EBOOK: BIG BOOK OF MACHINE LEARNING USE CASES 2ND EDITION 33 Loading a logged model from one of our runs",Chunk 242: How do you predict the outcome of elections?
243,"Next steps Now that we've run through our data with several different stretch factors, As you can see, our MLflow model is predicting new and unseen values with ease. the natural next step is to examine our results and look for a model that did And since it conforms to the Inference API, we can deploy our model on any","Chunk 243: In this post, I'm going to show you how to use the Inference API to build a machine learning model that can predict the"
244,"particularly well according to the metrics that we've logged. MLflow makes it easy serving platform (such as Microsoft Azure ML or Amazon SageMaker), deploy it as to then reload a logged model, and use it to make predictions on new data, using a local REST API end point, or create a user-defined function (UDF) that can easily the following instructions:",Chunk 244: We've been using MLflow to make predictions about what the weather will be like in the next few weeks...
245,"be used with Spark SQL. In closing, we demonstrated how we can use dynamic 1. Click on the link for the run you'd like to load our model from time warping to predict sales trends using the Databricks Unified Data Analytics Platform. Try out the Using Dynamic Time Warping and MLflow to Predict Sales 2. Copy the ""Run ID""","Chunk 245: In this session, we learned how to use dynamic time warping and MLflow to predict sales."
