Chunk Number,Original Text Chunk,Summary
583,"From there, we could choose to hoist any of the fields up to top level columns using geographic data structures, including their features, properties and spatial extents. Spark's built-in explode function. For example, we might want to bring up geometry, For this example, we will read NYC Borough Boundaries with the approach taken properties and type and then convert geometry to its corresponding JTS class, as depending on the workflow. Since the data is conforming to JSON, we could use","Chunk 583: In this lesson, we will use Spark's built-in explode function to create a map of the boroughs of New York City."
584,was shown with the WKT example. the Databricks built-in JSON reader with optioncmutlineuue) to load the data Spython with the nested schema. from pyspark.sql import functions as F,Chunk 584: In this article I will show how to use the Databrick
585,"json_explode_df = ( json_df.select Spython ""features"", json_df = spark.read.option (""multiline"", ""true"")-json (""nyc_boroughs. ""type"",",Chunk 585: New York City is one of the world's
586,"geojson"") F.explode (F.col CFeatures.properties?).alias (""properties"") ). select ( F.explode (F. col : features.geometry""7).alias (""geometry"")). drop (""features"")) D json_df: PpdtmDaNfens",Chunk 586: F.explode (F.col CFeatures
587,asplydan.-ploa.an features: array V element: struct geometry: struct coordinates: array,Chunk 587: Asplydan.-ploa.an is
588,type properties geometry element: array FeatureCollection wobject wobject,Chunk 588: A selection of some of the quirkier snippets from
589,"element: array boro_code:2 coordinates I-73.89680885 357), element: array",Chunk 589: BBC Sport takes a look at some of the key
590,"boro name: Bronx [-73.8972 038 843939 994), element: double shape_area: 1186612476.97",Chunk 590: The name of the New York City borough of Bronx
591,"173.89857332865558, 73.8919434249981, ,40 960691 40 79634). type: string shape_Jeng: 462958.186921 73.897882532",Chunk 591: shape_Jeng: 462958.186
592,properties: struct -73.896 boro_code: string boro_name: string 3.8,Chunk 592: properties: struct -73.896 boro
593,shape_area: string -73.8883725137 shape_leng: string type: string type: string,Chunk 593: A selection of the most popular strings from the BBC
594,"Figure 8: Using the Spark's built-in explode function to raise a field to the top level, displayed within al DataFrame table Figure 7: Using the Databricks built-in JSON reader opioncmutlinetue), to load the data with the nested schema databricks",Chunk 594: Figure 8: Using the Spark's built-in explode function to raise a field to
595,"EBOOK: BIG BOOK OF MACHINE LEARNING USE CASES 2ND EDITION 73 We can also visualize the NYC Taxi Zone data within a notebook using an existing DataFrame or directly rendering the data with a library such as Folium, a Python library for rendering spatial data. Databricks File System (DBFS) runs over a",Chunk 595: New York City's Taxi and Limousine Commission (TLC) is using Webrick's DataFrames to store and
596,"distributed storage layer, which allows code to work with data formats using familiar file system standards. DBFS has a FUSE Mount to allow local API calls that perform file read and write operations, which makes it very easy to load data with non-distributed APIs for interactive rendering. In the Python open(..) command Figure 9: We can also visualize the NYC Taxi Zone data, for example, within a","Chunk 596: In this tutorial, we'll look at how to use the Django Big Data Server (DBFS) to store and query large amounts of data."
597,"below, the ""/dbfs/."" prefix enables the use of FUSE Mount. notebook using an existing DataFrame or directly rendering the data with al library such as Folium, al Python library for rendering geospatial data Spython import folium","Chunk 597: The ""/dbfs/"" prefix enables the use of FUSE Mount."
598,"import json Shapefile is a popular vector format developed by ESRI that stores the geometric with open /dbfs/ml/blogs/geospatial/nyc_boroughs. .geojson"", ""r"") as location and attribute information of geographic features. The format consists myfile:",Chunk 598: This file contains a . Shapefile and a .geo file
599,"of a collection of files with a common filename prefix (*.shp, *shx and *.dbf are bore.data-ylle.reado # read GeoJSON from DBFS using FuseMount mandatory) stored in the same directory. An alternative to shapefile is KML, also m = folium.Map ( used by our customers but not shown for brevity. For this example, let's use NYC","Chunk 599: A shapefile is a collection of files with a common filename prefix (*.shp, *shx and *.d"
600,"location-[40.7128, -74.00601, tiles-'Stamen Terrain', Building shapefiles. While there are many ways to demonstrate reading shapefiles, zoom_start-12 we will give an example using GeoSpark. The built-in ShapefileReader is used to",Chunk 600: In this video we will show how to read shapefiles using
601,") folium.GeoJson (json.loads (boro_data)) .add_to (m) generate the rawSpatialDf DataFrame. m # to display, also could use displayHTML (.. .) variants scala",Chunk 601: folium.GeoJson (.loads
602,"var spatialRDD = new SpatialRDD [Geometryl spatialRDD = ShapenleReader.readregeometryRDD (sc, ""/ml/blogs/ PAEAANPeeT var rawSpatialDf = Adapter.toDf (spatialRDD, spark) rawdpatialDf.createoneplacerempviex C""rawSpatialDE""? //DataFrame now",Chunk 602: varRDD = new SpatialRDD [Geo
603,"available to SQL, Python, and R databricks EBOOK: BIG BOOK OF MACHINE LEARNING USE CASES 2ND EDITION 74 By registering rawSpatialDf as a temp view, we can easily drop into pure Spark","Chunk 603: With the release of Spark 2ND, it is now possible to run"
604,"Raster data SQL syntax to work with the DataFrame, to include applying a UDF to convert the Raster data stores information of features in a matrix of cells (or pixels) organized into shapefile WKT into Geometry. rows and columns (either discrete or continuous). Satellite images, photogrammetry","Chunk 604: syntax to work with the DataFrame, to include applying a UDF to convert the Raster data stores"
605,"and scanned maps are all types of raster-based Earth Observation (EO) data. 8sql SELECT *, ST_ GeomFromwKT (geometry) AS geometry GeoSpark UDF to convert WKT to The following Python example uses RasterFrames, a Dataframe-centric spatial Geometry FROM rawspatialdf",Chunk 605: RasterFrames can be used to convert raw raster-based Earth observation data into
606,"analytics framework, to read two bands of GeoTIFF Landsat-8 imagery (red and near-infrared) and combine them into Normalized Difference Vegetation Index. We can use this data to assess plant health around NYC. The rf_ipython module Additionally, we can use Databricks' built-in visualization for in-line analytics, such is used to manipulate RasterFrame contents into a variety of visually useful forms, as charting the tallest buildings in NYC.",Chunk 606: We are using Databricks' ipython.
607,"such as below where the red, NIR and NDVI tile columns are rendered with color ramps, using the Databricks built-in displayHTMLC) command to show the results 8sql within the notebook. SELECT name,","Chunk 607: In this tutorial, I will show you how to display the results of"
608,"round (Cast (num floors AS DOUBLE), 0) AS num_floors --String to Number FROM rawspatialdf Spython WHERE name # construct a CSV ""catalog"" for RasterFrames 'raster' reader",Chunk 608: The BBC's science and technology correspondent Nick Triggle
609,"ORDER BY num_floors DESC LIMIT 5 # catalogs can also be Spark or orid TradeCtr WTC Figure 10: AI Databricks built-in visualization for in-line analytics charting, for example,",Chunk 609: The World Trade Center (WTC) in New York is
610,"the tallest buildings in NYC databricks EBOOK: BIG BOOK OF MACHINE LEARNING USE CASES 2ND EDITION 75 Through its custom Spark DataSource, RasterFrames can read various raster","Chunk 610: The world's tallest building, the Burj Khalifa in"
611,"* LE results: PpMagatmaDifiem: [ongitude.Jatitude: udt, rf.tile(red): udt. -2moret fields] Showing only top 51 rows formats, including GeOTIFF, JP2000, MRF and HDF, from an array of services. longitude_Jatitude rf_tile(red) rf_tile(NIR) rf_tile(NDVI)",Chunk 611: Satellite images courtesy of the European Space Agency.
612,"It also supports reading the vector formats GeoJSON and WKT/WKB. RasterFrame contents can be filtered, transformed, summarized, resampled and rasterized POINT (75.6431054921628. 41.35507991091221) through over 200 raster and vector functions, such as st_reproject() and st_centroid.) used in the example above. It provides APIs for Python, SQL and",Chunk 612: Ster-centroid is a Python program that reads the raster data from the Ster-centroid
613,Scala as well as interoperability with Spark ML. POINT (75.55129747458508 41.3555632722104) POINT (75.64242580157753 41.285904858936576) POINT (75.55071479581207 41.28638012434911) POINT (7545900176161878: 41.286782331725604),Chunk 613: A new version of the Scala programming language has been
614,"Screenshot Figure 11: RasterFrame contents can bei filtered, transformed, summarized, resampled and rasterized through over 200 raster and vector functions databricks EBOOK: BIG BOOK OF MACHINE LEARNING USE CASES 2ND EDITION","Chunk 614: RasterFrames are a new way to store, share and"
615,76 Geodatabases Getting started with geospatial analysis on Databricks Geodatabases can be file based for smaller scale data or accessible via JDBC/ODBC connections for medium scale data. You can use Databricks to,Chunk 615: Get started with 76 Geodatabases Getting started with 76 Geodatabases
616,Businesses and government agencies seek to use spatially referenced data in query many SQL databases with the built-in JDBC/ODBC Data Source. conjunction with enterprise data sources to draw actionable insights and deliver Connecting to PostgreSQL is shown below and is commonly used for smaller on a broad range of innovative use cases. In this blog we demonstrated how the,Chunk 616: How do you connect disparate data sources to deliver insights?
617,"scale workloads by applying PostGIS extensions. This pattern of connectivity Databricks Unified Data Analytics Platform can easily scale geospatial workloads, allows customers to maintain as-is access to existing databases. enabling our customers to harness the power of the cloud to capture, store and analyze data of massive size.","Chunk 617: PostGIS extends the power of the cloud to capture, store and analyze data of massive size."
618,"scala display ( Context.read.fomat (""jdbc"") In an upcoming blog, we will take a deep dive into more advanced topics for .option (""url"", jdbcUrl)",Chunk 618: Check out our selection of some of the most interesting
619,"geospatial at-scale with Databricks. You will find additional details option (""driver"", or.poatyreglpriver? processing .option (""dbtable"",","Chunk 619: You will find additional details option (""driver"","
620,about the spatial formats and highlighted frameworks reviewing Data MIn * by (SELECT FROM ellocsripata.taging,"Chunk 620: In our series of letters from African journalists, journalist"
621,"OFFSET 5 LIMIT 10) AS t"""") //predicate pushdown Prep Notebook, GeoMesa + H3 Notebook, GeoSpark Notebook, GeoPandas option (""user"", jdbcUsername) Notebook, and RasterFrames Notebook. Also, stay tuned for a new section in our option 'jdbcPassword"", jdbcPassword)",Chunk 621: Stay up-to-date with the latest news and features in thejdbc
622,.load) documentation specifically for geospatial topics of interest. pep. pickup. 2019-01-0 2019-0,Chunk 622: This page is a collection of (i.e
623,2019 1:27 2019 2019 2019 2019,Chunk 623: BBC Sport takes a look back at some of the
624,2019-0 019-01 57:03 databricks EBOOK: BIG BOOK OF MACHINE LEARNING USE CASES 2ND EDITION 77,Chunk 624: BBC News NI looks at some of the key stories
625,CHAPTER 9: Exploring Twitter Introduction Sentiment and Crypto The market capitalization of cryptocurrencies increased from $17 billion in 2017 to $2.25 trillion in 2021.,Chunk 625: The value of cryptocurrencies has more than doubled in
626,"Price Correlation Using That's over a 13,000% ROI in a short span of 5 years! Even with this growth, cryptocurrencies remain Databricks incredibly volatile, with their value being impacted by a multitude of factors: market trends, politics, technology : and Twitter. Yes, that's right. There have been instances where their prices were impacted on","Chunk 626: Over the past 5 years, the value of cryptocurrencies has increased by more than 50%."
627,"account of tweets by famous personalities. As part of a data engineering and analytics course at the Harvard Extension School, our group worked on a project to create a cryptocurrency data lake for different data personas - including data engineers, ML practitioners and BI analysts = to analyze trends over time, particularly the impact of social media on the price volatility of a crypto asset, such as Bitcoin (BTC). We leveraged the Databricks Lakehouse Platform","Chunk 627: As part of a data engineering and analytics course at the Harvard Extension School, our group worked on a project to create a cryptocurrency data lake for different data personas - including data engineers"
628,"to ingest unstructured data from Twitter using the Tweepy library and traditional structured pricing data from Yahoo Finance to create a machine learning prediction model that analyzes the impact of investor sentiment on crypto asset valuation. The aggregated trends and actionable insights are presented on a Databricks SQL dashboard, allowing for easy consumption to relevant stakeholders. By Monica Lin, Christoph Meier,",Chunk 628: Databricks has teamed up with Tweepy Inc.
629,Matthew Parker and Kiran Ravella This blog walks through how we built this ML model in just a few weeks by leveraging Databricks and its collaborative notebooks. We would like to thank the Databricks University Alliance program and the extended team for all the support. databricks,Chunk 629: We used Databricks to build a machine learning (ML) model for a big data analytics project.
630,EBOOK: BIG BOOK OF MACHINE LEARNIN G USE CASES 2ND EDITION 78 Overview One advantage of cryptocurrency for investors is that it is traded 24/7 and The full orchestration workflow runs a sequence of Databricks notebooks that,Chunk 630: Blockchain technology is changing the way we interact with the world around us.
631,the market data is available round the clock. This makes it easier to analyze the perform the following tasks: correlation between the Tweets and crypto prices. A high-level architecture 1. Data ingestion pipeline of the data and ML pipeline is presented in figure 11 below.,Chunk 631: Twitter has developed a high-level architecture for ingestion and ML of its crypto market data.
632,Imports the raw data into the Cryptocurrency Delta Lake Bronze tables 2. Data science Cleans data and applies the Twitter sentiment machine learning Data Sources Chryptocurrency Delta Lake,Chunk 632: The following table lists the key data points from the 2016 European
633,model into Silver tables Cryp Aggregates the refined Twitter and Yahoo Finance data into an aggregated Gold table Rawtweets (Bronze),Chunk 633: Cryp aggregates the refined Twitter and Yahoo Finance data
634,Refinedrweets (Silver) Computes the correlation ML model between price and sentiment A 3. Data Yfina,Chunk 634: Find out more at: www.yfina.
635,analysis Rawticker data Refinedticker data Runs updated SQL BI queries on the Gold table (Bronze),Chunk 635: BBC News takes a look at some of the key
636,(Silver) DataQualiy AWSS3 Cloud Native Storage The lakehouse paradigm combines key capabilities of data lakes and data warehouses to enable all kinds of BI and Al use cases. The use of the lakehouse,Chunk 636: The DataQualiy AWSS3 Cloud Native Storage lakehouse paradigm
637,architecture enabled rapid acceleration of the pipeline creation to one 1: week. Figure Crypto Lake using Delta just,Chunk 637: Delta is an open-source software platform for building
638,"As a team, we played specific roles to mimic different data personas, and this paradigm facilitated the seamless handoffs between data engineering, machine learning and business intelligence roles without requiring data to be moved across systems. databricks","Chunk 638: In this episode of the Databricks podcast, databricks co-founder"
639,EBOOK: BIG BOOK OF MACHINE LEARNING USE CASES 2ND EDITION 79 Data/ML pipeline Data science Ingestion using a medallion architecture,Chunk 639: BBC News takes a look back at some of the
640,"The data science portion of our project consists of three major parts: exploratory The two primary data sources were Twitter and Yahoo Finance. A lookup table data analysis, sentiment model and correlation model. The objective is to build was used to hold the crypto tickers and their Twitter hashtags to facilitate the a sentiment model and use the output of the model to evaluate the correlation",Chunk 640: The objective of this project is to build a sentiment model to evaluate the correlation between the price of Ethereum and the price of Bitcoin.
641,"subsequent search for associated tweets. between sentiment and the prices of different cryptocurrencies, such as Bitcoin, Ethereum, Coinbase and Binance. In our case, the sentiment model follows a We used yfinance python library to download historical crypto exchange market supervised, multi-class classification approach, while the correlation model","Chunk 641: In this paper, we present a sentiment-based model for predicting the price of cryptocurrencies."
642,"data from Yahoo Finance's API in 15-minute intervals. The raw data was stored in a uses a linear regression model. Lastly, we used MLflow for both models' lifecycle Bronze table containing information such as ticker symbol, datetime, open, close, management, including experimentation, reproducibility, deployment and a central high, low and volume. We then created a Delta Lake Silver table with additional model registry. MLflow Model Registry collaboratively manages the full lifecycle of",Chunk 642: We used MLflow to run two regression models on approx.
643,"data, such as the relative change in price of the ticker in that interval. Using Delta an MLflow model by offering a centralized model store, set of APIs and UI. Some of Lake made it easy to reprocess the data, as it guarantees atomicity with every its most useful features include model lineage (which MLflow experiment and run operation. It also ensures that schema is enforced and prevents bad data from","Chunk 643: Google's artificial intelligence (AI) platform, Lake, has been used by the Wall Street Journal (WSJ) to build a machine learning (ML) model"
644,"produced the model), model versioning, stage transitions (such as from staging to creeping into the lake. production or archiving), and annotations. We used Tweepy Python library to download Twitter data. We stored the raw tweets in a Delta Lake Bronze table. We removed unnecessary data from the","Chunk 644: In this project, we used Python to create a 3D model of a lake in the middle of a"
645,Bronze table and also filtered out non-ASCII characters like emojis. This refined data was stored in a Delta Lake Silver table. databricks EBOOK: BIG BOOK OF MACHINE LEARNING USE CASES 2ND EDITION 80,Chunk 645: The table below shows the top 10 most popular books on Amazon in the
646,Exploratory data analysis amp Anonymous fransactions Private 4s 30 ttT :0,Chunk 646: http://www.firstcoastnews.com/
647,"using Smashcash The EDA section provides insightful visualizations on the data set. For example, we 25 ETH Blockchain looked at the distribution of tweet lengths for each sentiment category using violin","Chunk 647: In this section, we look at some of the key findings from"
648,20 SmashcashPlatforn SHIBAINU want plots from Seaborn. Word clouds (using Matplotlib and wordcloud libraries) for 6 15,Chunk 648: BBC Sport looks at some of the more unusual plots
649,INU Transaction: make SHIBA 5 positive and negative tweets were also used to show the most common words for 10 EICMI-XRP Anywhere Close,Chunk 649: As part of our series of letters from African journalists
650,"the two sentiment types. Lastly, an interactive topic modeling dashboard was built, 5 yer su E E  CO","Chunk 650: In our series of letters from African journalists, filmmaker"
651,"using Gensim, to provide insights on the top most common topics in the data set positive neutral negative BTCGasparino",Chunk 651: BTCGasparino and Gensim have teamed up
652,"and the most frequently used words in each topic, as well as how similar the topics sentiment XRP BTX ETH are to each other.",Chunk 652: Find out what people are saying about BTX ETH
653,Figure 2: Violin plots for text length Figure 3: Word cloud for positive and negative tweets Topic Previous Topi Nerl Topi Cles Topi Slide tric2),Chunk 653: Figure 2: Violin plots for text length Figure 3: Word
654,"A-1 Intertopic Distance Map (van mutidimensional: scaling) Top-30 Most Salient Terms"" Figure 4: Interactive topic modeling dashboard databricks",Chunk 654: BBC News takes a look at some of the most
655,"EBOOK: BIG BOOK OF MACHINE LEARNING USE CASES 2ND EDITION 81 Sentiment analysis model Developing a proper sentiment analysis model has been one of the core tasks In this project, we focused on the latter two approaches since they are supposed","Chunk 655: In our series of letters from African journalists, film-maker and columnist Ahmed Rashid looks at"
656,"within the project. In our case, the goal of this model was to classify the polarities to be the most promising. Thereby, we used SparkNLP as the NLP library of choice that are expressed in raw tweets as input using a mere polar view of sentiment due to its extensive functionality, its scalability (fully supported by Apache (i.e., tweets were categorized as ""positive,"" ""neutral"" or ""negative""). Since sentiment SparkM) and accuracy (e.g. it contains multiple state-of-the-art embeddings and","Chunk 656: In our case, we used sentiment SparkM as the NLP library of choice that are expressed in raw tweets as input using a mere polar view of sentiment due to its extensive functionality, its"
657,"analysis is a problem of great practical relevance, it is no surprise that multiple ML allows users to make use of transfer learning). First, we built a sentiment analysis strategies related to it can be found in literature: pipeline using the aforementioned classical ML algorithms. The following figure shows its high-level architecture consisting of three parts: preprocessing, feature Sentiment lexicons algorithms","Chunk 657: In this paper, we present a novel approach to sentiment analysis using classical ML algorithms (i.e."
658,"Off-the-shelf sentiment analysis systems vectorization and finally training including hyperparameter tuning. Compare each word in a tweet to a database Exemplary systems: Amazon Comprehend, of words that arel labeled as having positive or Google Cloud Services, Stanford Core NLP negative sentiment","Chunk 658: In this talk, I will show how sentiment analysis can be used to predict the likelihood of"
659,"Pros: do not require great preprocessing Preprocessing stages At tweet with more positive words than negative of the data and allow the user to directly would be scored as a positive and vice versa start a prediction ""out of the box"" Pros: straightforward approach",Chunk 659: BBC Sport takes a look at some of the ways artificial intelligence (AI) could be used to predict
660,Cons: limited fine-tuning for the underlying Document Tokenizer Normalizer Stopwords Lemmatizer Stemmer Finisher use-case (retraining might be needed to Assembler Cleaner,Chunk 660: Pros: easy-to-use tool that can
661,Cons: performs poorly in general and greatly adjust the model performance) depends ont the quality of the database of words Classical ML algorithms Deep Learning (DL) algorithms Feature Vectorization,Chunk 661: Pros: performs well in general and greatly adjust the model performance
662,"Training & Tuning Application of traditional supervised classifiers Application of NLP related neural network like logistic regression, random forest, support architectures like BERT, GPT-2/ GPT-3 mainly vector machine or Naive Bayes via transfer learning",Chunk 662: Research and development (R&D) of artificial intelligence (AI) and
663,"HashingTF IDF Classifier (LogReg, NB, RF, SVC) Pros: well known, often financially and Pros: many pretrained neural networks for",Chunk 663: BBC News takes a look at the pros and cons
664,"computationally cheap, easy toi interpret word embeddings and sentiment prediction already exist (particularly helpful for transfer Figure 5: Machine learning model pipeline Cons: in general, performance on unstructured learning), DL models scale effectively with data",Chunk 664: Deep Learning (DL) has the potential to transform the way we work with
665,data like text is expected to be worse compared to structured data and necessary Cons: difficult and computationally expensive preprocessing can be extensive to tune architecture and hyperparameters databricks,"Chunk 665: Pros: low-cost, easy-to-use,"
666,"EBOOK: BIG BOOK OF MACHINE LEARNING USE CASES 2ND EDITION 82 We run this pipeline for every classifier and compare their corresponding Correlation model accuracies on the test set. As a result, the Support Vector Classifier achieved the",Chunk 666: A group of students from the University of Bristol have been given a set of classifiers
