Chunk Number,Original Text Chunk,Summary
67,"pièce et fonctionnait grâce à une mécanique mue par l'eau selon le principe des boucles de rétroaction. Ces exemples montrent qu'il y a plus de deux mille ans, les principes de l'automatisme et de la systémique, qui sont les bases de l'informatique et de l'intelligence artificielle, étaient non seulement posés, mais donnaient lieu à la fabrication de leurs objets.","Chunk 67: Ces principes de l'automatisme et de la systémique, les principes de l"
68,"Les premiers ordinateurs n'étaient pas si éloignés des machines de PAntiquité. La grande différence est la capacité de réaliser des opérations logiques intégrant le < et > et le < ou "",grâce aux transistors. Ensuite, la miniaturisation a permis d'augmenter le nombre de composants élémentaires par surface, donc de passer à des calculs plus complexes. Si la technologie change, le désir",Chunk 68: Les ordinateurs s'enfant  l'Institut National de la Recherche Scientifique (INR) a
69,"de reproduire, voire de surpasser le raisonnement humain reste une constante dans l'histoire de l'humanité. b) Des années 1950 à aujourd'hui En 1952,Alan Turing, l'un des fondateurs de l'informatique, avait déjà réalisé un programme de jeu d'échecs, proche des systèmes experts actuels. Il fallait","Chunk 69: Alan Turing, the British codebreaker who cracked the Enigma code during the Second World War, has died"
70,"une demi-heure pour que la machine propose chaque coup. En 1956, le séminaire de Darmouth a réuni pendant dix semaines des scientifiques de très haut rang pour définir l'intelligence artificielle. Parmi eux se trouvaient 7. < Machine d'Anticythère: Google célèbre l'ancêtre des calculateurs > lepoint.fr, 17 mai 2017, www.lepoint.fr/ storomiemachnedanipherpegectelamcreddlus1205202222940, 1925.php).","Chunk 70: Une machine d'Anticythre, Google, s'agit  Darmouth,"
71,"15 John McCarthy, Marvin Minsky (cofondateur du laboratoire d'intelligence artificielle au MIT, père des réseaux de neurones), Herbert Simon (prix Nobel d'économie 1978, inventeur de la rationalité limitée) et Claude Shannon (inventeur de la théorie de l'information) 8. L'un des objectifs fondamentaux de","Chunk 71: The winners of this year's Nobel Peace Prize have been announced at a ceremony in Oslo,"
72,"ce séminaire était de comprendre ce qu'était l'intelligence, au travers d'outils informatiques, avec un autre langage que celui des êtres humains. II fut la base de nombreux travaux théoriques et pratiques, comme l'invention de langages de programmation orientés vers l'intelligence artificielle. Cette compréhension de l'intelligence que souhaitaient appréhender les",Chunk 72: Cette tte--tte tte--tte
73,"participants du séminaire se retrouve dans les mots de Hiroshi Ishiguro (voir photo), l'un des grands chercheurs sur les robots humanoides à l'université d'Osaka : < Je construis des robots pour comprendre ce qu'est la conscience"".> D'ailleurs, il est encore plus difficile de définir la conscience que l'intelligence, d'ow l'idée intéressante de construire des machines encore plus perfectionnées","Chunk 73: D'ailleurs, il est encore plus difficile de définir la conscience que l'intelligence, d'ow l'id"
74,"que les ordinateurs pour interroger la conscience. I Hiroshi Ishiguro et son dual robotique. Source : << Hiroshil Ishiguro: Robots like mine will replace pop stars and Hollywood actors >, International business, Times, 22nd of March, 2015.","Chunk 74: The British film-maker Hiroshi Ishiguro, best known for his"
75,"c) Les différentes écoles du dèveloppement de l'intelligence artificielle L'approche humaine La première école a tenté d'imiter le raisonnement d'un être humain. Un nouveau: métier était né : le cogniticien, dont le rôle consistait à discuter avec un expert de ses méthodes de résolution de problèmes, puis à projeter son expertise",Chunk 75: c) Les différentes écoles du dveloppement de l'intelligence artificielle
76,"dans un langage logique compréhensible par un ordinateur, par exemple, en réalisant des outils d'aide à la décision sous forme de graphiques, d' arbres de décision >. Cette méthode se heurtait à plusieurs problèmes. D'abord, 8. Voir. John McCarthy, Marvinl L.I Minsky, Nathaniel Rochestere et Claude E.Shannon, <<A AProposalfort the Dartmouth Summer Research Project on Artificiall Intelligence. August 31,1955 ,AI Magazine, vol.27, n"" 4, hiver 2006,p. 12-14",Chunk 76: Cette méthode se heurtait  problmes.
77,"wwaaiogogindexphpaimaprheanteeMEW/1904/1802, 9. Voir l'intervention de Hiroshi Ishiguro, < The Future Life Supported by Robotic Avatars >, au Global Future 2045 International Congress, New' York, 15-16 juin 2013, youtube.com lwwwgputubecom'watch,-h34p5i.0, 16 les experts pouvaient se sentir dépossédés s'ils dévoilaient leur expertise ; le","Chunk 77: Le futur de Hiroshi Ishiguro,  The Future Life Supported by Robotic Avatar"
78,"cogniticien devait alors faire tout un travail d'approche psychologique pour ne pas heurter leur sensibilité. Ensuite, les langages informatiques traditionnels étaient procéduraux, et ainsi mal adaptés à une logique de règles. On a donc inventé des langages tels LISP ou Prolog, dont la syntaxe est celle d'un moteur de règles. Ces langages sont aujourd'hui tombés en désuétude. De plus,",Chunk 78: Une sensibilité peut-on tre leur sensibilité  l'auteur
79,"un moteur de règles n'apparaît pas logiquement rigoureux, en fonction de l'antécédence d'une règle par rapport à une autre. Dans les années 1990, les factures des opérateurs de téléphonie mobile pouvaient varier de quelques pourcents en fonction du chemin emprunté pour calculer le prix, c'est--dire de la manière dont le système informatique choisit l'ordre de ses règles de","Chunk 79: Dans un moteur de rgles n'apparat pas logiqueeux, en fon de l'ant"
80,"calcul. L'analyse factorielle et des données La deuxième école, qui s'est souvent confrontée à la première, utilisait des outils statistiques et, surtout, rejetait tout ce qui était modélisation de l'humain, en d'autres mots, tout ce qui était moteur de règles. La palette des",Chunk 80: La deuxime école s'est souvent confrontée  la
81,"outils était large, allant de méthodes de classification traditionnelles, comme les analyses factorielles, à des modélisations sophistiquées, comme les chaînes de Markov qui ont été longtemps la base des logiciels de dictée automatique. Ce fut l'occasion d'un conflit supplémentaire entre < sciences molles >, celles qui privilégiaient une approche plutôt inductive basée sur les modélisations",Chunk 81: L'occasion d'un conflitlémentaire entre  sciences molles qui privilégiaient une
82,"de l'humain, et < sciences dures >, qui, à l'inverse, partaient des données et refusaient tout anthropomorphisme. Comme le déclare le statisticien Jean Paul Benzécri, le fondateur de l'analyse des données, < le modèle doit suivre les données, et non l'inverse 10 >. Limitation de la nature","Chunk 82: Le modle doit suivre les dons, et non l'inverse 10,"
83,"La troisième école a souhaité modéliser la nature et le cerveau humain. Ce fut le début des réseaux de neurones, une catégorie d'algorithmes utilisant le paradigme du cerveau pour résoudre des problèmes. Les réseaux de neurones sont actuellement dominants dans toutes les applications liées à la reconnaissance des formes : compréhension du langage, traduction",Chunk 83: L'Institut National de la Recherche Scientifique (INRC) avait tre un troisi
84,"automatique, analyse d'image, etc. Ils sont, par exemple, à la base des voitures autonomes. 10.Citép par Dominiquel Desbois,ine < La place del'ap prioridansl'analyset des données économiques oul le programme fort des méthodes inductives au service de l'hétérodoxie: >, Revue Modulad, no 39, décembre 2008, P. 176 (téléchargeable sur pAPeNR Laj place de 127a priori dans! 1%27analyse",Chunk 84: Les méthodes économiques de l'hrodoxie peut-tre t
85,"des donnees economiques oul le programme fort des methodes inductives au service de M27heterodoxie). 17 La recherche d'un algorithme unique Le professeur Pedro Domingos, de l'université de Washington, va plus loin en partant de cinq formes d'apprentissage : l'inférence humaine fondée sur la",Chunk 85: Une recherche d'un algorithme uniquee de M27heterodoxie
86,philosophie et la logique ; la compréhension du cerveau sur les neurosciences ; la simulation de lévolution sur la génétique ; l'inférence bayésienne sur les probabilités ; la recherche d'analogies sur loptimisation mathématique croisée avec la psychologie 11. Pedro Domingos énonce que tous ces algorithmes vont finalement converger vers un algorithme unique (K the master algorithm >).,Chunk 86: Pedro Domingos s'agitre  l'Institut National de la Recherche Scientifique (INR)
87,Mélanger les chercheurs des sciences dures avec ceux des sciences molles constitue néanmoins un exercice à très haut risque. Cette distinction entre plusieurs types de modélisation reste importante. Elle illustre le rôle fondamental de l'apprentissage. La grande différence entre l'intelligence artificielle et les programmes traditionnels est l'importance,Chunk 87: La différence de l'intelligence artificielle et les programmes traditionnels est l'importance
88,"de la capacité d'apprentissage du programme lui-même. Un programme classique ne change que lorsque l'humain le reprogramme ; un programme d'intelligence artificielle va évoluer en fonction de la validité des résultats qu'il génère : s'il se trompe souvent, il va automatiquement s'améliorer, en partant des données et pas d'une modélisation du comportement humain. Mais,",Chunk 88: Un programme d'intelligence artificielle va évoluer en fonction de la validité des résultats
89,"surtout, cette distinction pose la question de l'autoréflexion : est-il possible de comprendre l'intelligence en essayant de la modéliser avec ses propres paradigmes ? Le cerveau humain n'utilise pas d'outils informatiques stricto sensu. Il n'a pas d'additionneur ni de porte logique. La vitesse de transmission entre les neurones est de l'ordre du centième de seconde ; notre cerveau est",Chunk 89: The BBC's science and technology correspondent Tomi Oladipo looks at some of the key questions surrounding artificial intelligence.
90,"un processeur fonctionnant à 100 Hz, soit trente mille fois plus lent qu'une puce Intel de 2017.Les ingénieurs savent bien qu'il faut s'inspirer de la nature mais pas la reproduire. Un avion n'a pas de plumes et ne bat pas des ailes. La même idée fonctionne pour le numérique : il faut s'inspirer du comportement du cerveau mais pas le copier.","Chunk 90: Un processeur fonctionnant  100 Hz, soit trente mille fois plus lent qu'une puce Intel"
91,"Les méthodes statistiques se sont finalement révélées plus performantes que la modélisation de l'expertise lorsque la complexité du problème augmentait, surtout lorsque la quantité de données disponibles pour l'apprentissage des algorithmes a explosé. Les sciences dures, plus efficaces en ce qui concerne lapprentissage en continu, ont pris le pas sur les sciences molles sur toute une",Chunk 91: Les méthodes statistiques se sont finalement révélées plus performantes la modélisation
92,"catégorie de problèmes complexes. 11. Voir Pedro Domingos, The Master Algorithm. How the quest for the ultimate learning machine will remake our world, Basic Books, 2015. 18 4. LES GRANDES RUPTURES DE 2011","Chunk 92: How the quest for the ultimate learning machine remakes our world, Basic"
93,"Aux alentours de 2011,trois grandes ruptures quasi concomitantes ont permis à l'intelligence artificielle de franchir une grande étape : - tout d'abord, l'introduction d'une catégorie d'algorithmes bien plus sophistiqués : les réseaux de neurones convolutifs ; - ensuite,larrivée sur le marché de processeurs graphiques à bas coût capables",Chunk 93: Anniversaire de l'Institut National de la Recherche Scientifique (INR) s'
94,"d'effectuer d'énormes quantités de calculs; > -enfin, la disponibilité de très grandes bases de données correctement annotées permettant un apprentissage plus fin. Les premiers réseaux de neurones modélisaient le comportement des synapses. Ils partaient de données numériques, qui pouvaient être une image, et essayaient",Chunk 94: A l'Institut National de la Recherche Scientifique (INR) et l'Institut
95,"de transformer ces données en une information, par exemple < C'est l'image d'un chien >, via des algorithmes qui s'inspiraient du fonctionnement des neurones du cerveau. Lapprentissage consistait à calculer les paramètres de ces réseaux de neurones sur des jeux de tests, tels que des couples image-animal. Les neurosciences faisant d'énormes progrès en parallèle, les chercheurs",Chunk 95: Lapprentissage consistait  calculer les paramtres de ces réseaux de neurones sur
96,"purent améliorer larchitecture de ces réseaux de neurones. Entre autres, l'idée de s'inspirer du cortex visuel a permis de définir une nouvelle classe d'algorithmes, les réseaux de neurones convolutifs. Ce sont ces algorithmes qui sont aujourd'hui utilisés dans les grandes applications de l'intelligence artificielle, comme la reconnaissance de la parole de Siri, la voiture autonome",Chunk 96: Cet classe d'algorithmes sont ces algorithmes qui sont aujourd'hui 
97,"de Google ou bien la reconnaissance d'images de Facebook. Ces réseaux de neurones ont besoin d'énormes puissances de calcul pour pouvoir fonctionner, tout comme un autre champ d'application, le minage des bitcoins 12. La solution pour ce dernier a été d'utiliser les cartes graphiques des ordinateurs, qui devaient créer en temps réel des images animées pour les",Chunk 97: C'est un fonctionner d'un ordinateur de ordinateurs graphiques.
98,"jeux vidéo. Ces cartes graphiques (en anglais GPU, pour graphics processing unit) ont vu d'un seul coup leurs usages aller bien au-delà de leur premier rôle, permettant d'ailleurs à la société Nvidia, leader sur ce marché, de voir son action en Bourse multipliée par trente en neuf ans. Par ailleurs, tous les statisticiens savent que la qualité et la quantité de données",Chunk 98: Nvidia s'est déj vu  l'arrivée d'un coup d'un rle  l'
99,"à utiliser pour l'apprentissage sont fondamentales. Plus il y a de données qualifiées, plus lapprentissage sera fin, et plus Palgorithme sera fiable et précis. L'année 2011 a vu la création d'ImageNet, la première grande base de 12. Yves Caseau et Serge Soudoplatoff, La Blockchain, ou la confiance distribuée, Fondation pour l'innovation politique, juin 2016 Wwwfondapalogetudeescsevetsepesegpsoapsofia.edchainoula.confance.","Chunk 99: L'Innovation politique de la Blockchain, la premire base de 12 Yves Caseau et Serge Soudoplat"
100,"distribuee/). 19 données d'images annotées 13. Créée par. Fei-Fei Li, professeure. à l'université de lllinois, la base a très vite atteint 1 million d'images annotées selon un arbre sémantique, Wordnet, mis au point en 1980 par George Miller, professeur","Chunk 100: All photographs  AFP, EPA, Getty Images and Reuters"
101,"à Princeton 14. À présent, en 2017, ImageNet propose 14 millions d'images indexées selon plus de 21 000 catégories. II s'agit d'une base de données ouverte et, chaque année, est organisé un concours des meilleurs algorithmes de détection d'éléments dans les images 15 Graphique 1: Exemple de données de la base ImageNet",Chunk 101: ImageNet s'agit d'une base de dons ouverte et s'agit d'
102,P S mammal placental carnivore,Chunk 102: BBC News NI takes a look at some of the
103,canine dog working dog husky F an - lay - e difay 1  à,Chunk 103: canine dog working husky F an - lay and e
104,  I Image extraite du site web de ImageNet. Ces trois grandes ruptures sont liées. Aucune n'aurait suffi à elle seule pour,Chunk 104: C'est l  l'
105,créer une véritable différence. Ce n'est pas tant la conception d'algorithmes sophistiqués qui a permis à l'intelligence artificielle de se développer - les réseaux de neurones convolutifs sont des versions raffinées mais pas très différentes dans leur esprit de celles développées dans les années 1990 - que la combinaison de ce raffinement algorithmique avec laugmentation de la,Chunk 105: Ce n'est pas tant la conception d'algorithmes sophistiqués qui a permis 
106,"puissance de calcul et, surtout, avec la disponibilité de bases de données de plus en plus importantes en taille et en qualité, qui fait qu'aujourd'hui l'intelligence artificielle est capable de réaliser des tâches de plus en plus sophistiquées. 13. Pour en savoir plus, voir htp/mmwamagenetog. 14. Voir Dave Gershgorn, & The datat that transformed/ Al research-and possibly the world >, qz.com, 26j juillet 2017",Chunk 106: Une tches de plus en plus sophistiquées peut--tre tre  l'
107,"zcom/0.4972Ahedatardangeditedietedidendhaeseachamépassiblythewona), 15. Voir < Large Scale Visual Recognition Challenge 2017 >:i imagenetog/.halengesSVRC201/indez 20 5. DU BIG DATA AU DATA MINING Le big data est la grande rupture de notre époque, qui a permis à l'intelligence",Chunk 107: Voir  Large Scale Visual Recognition Challenge >:i imagenetog
108,"artificielle de faire des bonds énormes. Nous sommes dans un monde de production de données en masse. Certaines sont publiques, d'autres sont privées. En 2017, lors d'une seule journée, on a pu observer 96 millions de messages sur Instagram, 200 millions de nouvelles photos et 456 millions de mises à jour de statuts dans Facebook, 645 millions de tweets, 5,5 milliards de requêtes sur",Chunk 108: Nous sommes dans un monde de production de dons en faire.
109,"Google, 417 milliards de messages sur WhatsApp 16 La possession de ces données donne un pouvoir énorme aux GAFA17 et à leurs équivalents chinois. Néanmoins, Google nous offre des interfaces de programmation permettant d'interroger les siennes. Google Maps, par exemple, autorise l'accès à la cartographie de la planète entière. Google",Chunk 109: Google avait tre l'arrivée de WhatsApp  l'aprs
110,"propose un site où nous pouvons comparer les tendances sur plusieurs mots- clés, avec possibilité de zoomer sur des zones géographiques, sur des échelles de temps, ou bien de filtrer sur des catégories.. À titre d'exemple, nous pouvons ainsi comparer lévolution de l'intérêt pour la recherche < Macron > versus < Trump > entre novembre 2016 et novembre 2017 (voir graphique 2)18.","Chunk 110: Avec Donald Trump et Emmanuel Macron, nous pouvons comparer lé de l'intért pour la recherche "
111,Graphique 2: Trump versus Macron dans une requête Google Evolution de Tintérêt pour cetter recherche @ * <> < 7mal-13mal2017 Macron 27,Chunk 111: President Donald Trump and French President Emmanuel Macron sparred
112,Trump 24 Moyenne 27 nov. 2016 2avr. 2017 6aolt 2017 Source :G Google trends : htps/tendsgpoglecogecom/ltends/epborerg-Macron.fump.,"Chunk 112: Google searches for the words ""Trump"" and """
113,"On voit que les recherches < Macron > ont dépassé les recherches < Trump > début mai 2017. Que s'est-il passé à ce moment ? Pour le savoir, il suffit de regarder sur la même page du site, un peu plus bas, quelles sont les requêtes associées (voir graphique 3). En position 3 et 4, nous trouvons la fameuse poignée de main entre Emmanuel Macron et Donald Trump qui a","Chunk 113: Les recherches  Donald Trump s'est-il passé  ce moment, s'est-il passé  Emmanuel Macron"
114,"enthousiasmé le monde entier ! Nous savions que cette poignée de main était hautement symbolique. Google l'a quantifiée. 16. Pour des statistiques en temps réel, voir wwwintermetivestats.om/onesecond, 17.Acronyme désignant les quatre géants américains de l'Internet fixe et mobile que sont Google, Apple, Facebook et Amazon.",Chunk 114: Une fonctionnalité  Google nous avons sr 
115,18. Voir vemdspegecomvtendyepbeg-aco.lume 21 Graphique 3: Requêtes associées Requêtes associées Enj progression 1 * <> /,Chunk 115: Requtes associées Re
116,debat le pen macron Record 2 le debat macron le pen Record 3 macron handshake,Chunk 116: debat le pen macron Record 2 le de
117,Record macron trump handshake Record débat! le pen macron Record,Chunk 117: Record macron trump handshake Record débat.
118,"Source trendsgoogle.com/rends/eplorezq-Macron,frump. Il est également possible de faire des zooms par région sur la même requête (voir graphique 4). Le président des Etats-Unis retient l'attention du continent américain, mais en Russie, en France et dans certains pays africains, c'est le président Macron qui l'emporte.","Chunk 118: Le sident des Etats-Unis, Emmanuel Macron, a déj "
119,"Graphique 4: Requêtes Trump contre Macron selon les pays Source : tpe/Aemaspegerteay. Cette méthode fonctionne pour une pluralité de recherches. Par exemple, la comparaison entre Dementia et. Alzheimer a permis de montrer que le premier terme est utilisé dans le monde anglo-saxon, tandis que le second l'est en","Chunk 119: Par exemple, le premier terme est utilisé dans le monde anglo-sax"
120,"Europe et en Amérique latine. Cette facilité de faire du zoom in, c'est-à-dire d'aller du général au particulier, est l'un des plus puissants apports du big data. Il existe aussi des jeux de données qui sont publics. ImageNet en est un 22 exemple, mais nous avons aussi la carte du monde entier disponible grâce à","Chunk 120: C'est--dire d'imageNet, s'il avait tre "
121,"OpenStreet.Map. Certains sites comme Amazon ou Kaggle 19 permettent de savoir quelles sont les données publiques disponibles. Ces données sont importantes pour la compréhension de notre monde. Le statisticien Seth tephens-Davidowity, qui a accès aux données de Google, fait le constat que nous mentons tout le temps : aux sondages d'opinion, à",Chunk 121: Une site OpenStreet.Map s'agit  l'occasion d'un nouveau site Kaggle
122,"nos amis sur Facebook et dans tous les lieux de partage20. Le seul endroit où nous sommes sincères est lorsque nous posons une question à Google, qui est en quelque sorte devenu le psychanalyste de toute la planète. L'auteur montre ainsi, en analysant les requêtes contenant le mot < nègre >, que, contrairement à ce que prétendent nombre de sociologues, lAmérique est toujours très","Chunk 122: L'auteur montre ainsi, en analysant les requtes contenant le mot  ngre >"
123,"raciste. Dans un monde de plus en plus chaotique, les grandes tendances ne suffisent plus. Avant le big data, nous savions que tel Etat des Etats-Unis votait plutôt démocrate ou plutôt républicain. Avec le big data, nous pouvons le savoir à l'échelle d'un quartier ou d'une rue. Ce phénomène change radicalement une",Chunk 123: Etat des Etats-Unis votait  l'échelle d'un quartier
124,"campagne : les actions à entreprendre pour convaincre les électeurs potentiels sont bien plus ciblées. Ainsi, des chercheurs de Stanford ont réalisé un moteur d'intelligence artificielle qui, en analysant les voitures stationnées sur Google Street View, en déduisent la couleur politique du voisinage 21 Dans les exemples exposés ci-dessus, les données sont essentiellement utilisées","Chunk 124: Les chercheurs de Stanford ont réalisé un moteur d'intelligence artificielle qui, en an"
125,"pour essayer de comprendre des phénomènes. C'est ce que le monde anglo- saxon appelle le data mining, la capacité d'aller chercher des réponses dans des bases de données de plus en plus riches, croisées avec des outils de plus en plus sophistiqués. Néanmoins, l'humain est encore irremplaçable lorsqu'il 3 'agit de prendre des décisions à partir des résultats de ces méthodes statistiques. On","Chunk 125: C'est ce que le monde anglo- saxon appelle le data mining, la capacité d'aller cher"
126,"a vu qu'Emmanuel Macron a devancé Donald Trump en mai 2017 et que la machine peut faire la corrélation entre ce phénomène et l'émergence du mot handshake, mais la mise en contexte politique et l'interprétation de ce que cela signifie pour les relations diplomatiques entre la France et les Etats-Unis reste encore de l'ordre de la créativité et de l'esprit humain. Le temps n'est pas encore","Chunk 126: US President Donald Trump and French President Emmanuel Macron have held their first face-to-face meeting at the G20 summit in Hamburg, Germany."
127,"arrivé ou, à partir de ces données, un ordinateur en conclurait que le président Macron doit inviter le président Trump au défilé du 14 Juillet de la même année. D'une certaine manière, si le data mining est basé sur des méthodes scientifiques, l'interprétation des données a encore besoin des sciences molles. 19. Voir MnCpacdwV et wwwlagecon/ausets.","Chunk 127: Une mme mme scientifique, selon le sident Emmanuel Macron, s"
128,"20. Voir Seth Stephens-Davidowitz, Everybody Lies. Big Data, New Data, and What the Internet Can Tell Us About Who We Really Are, Dey Street Books, 2012. 21. Voir Andrew Myers, <<A An artificial intelligence algorithm developed by Stanford researchers can determine a neighborhood's politicalleaningsl by its cars >, standford.edu, 28 novembre 2017 mssuntodav2IyAV2e, negpbohodsasinicanepaltaleanings,","Chunk 128: Voir Seth Stephens-Davidowitz, Everybody Lies."
129,"23 En revanche, il est à craindre que les différences d'approches des législateurs sur le problème de la propriété des données engendrent un énorme différentiel dans la disponibilité industrielle d'IA. S'il est raisonnable de vouloir avertir le citoyen de ce que cela signifie d'échanger sur Facebook ou bien de poser","Chunk 129: Lors de l'AFP, nous avons tre  l'occasion de l'"
