Chunk Number,Original Text Chunk,Summary
1,0 eBook  Big Book of Machine Learning Use Cases,Chunk 1: A selection of the best machine learning and artificial intelligence
2,"A collection of technical blogs, including code samples and notebooks  - ",Chunk 2: BBC News takes a look at some of the best
3,databricks EBOOK: BIG BOOK OF MACHINE LEARNIN G USE CASES 2ND EDITION 2 Contents CHAPTER 1:,Chunk 3: BBC News NI takes a look at some of the
4,Introduction 3 CHAPTER 2: Moneyball 2.0: Improving Pitch-by-Pitch Decision-Making With MLB's Statcast Data 4,Chunk 4: Moneyball 2.0: Improving Pitch-by-Pitch
5,CHAPTER 3: Improving On-Shelf Availability for Items With Out-of-Stock Modeling 14 CHAPTER 4: Using Dynamic Time Warping and MLflow to Detect Sales Trends,"Chunk 5: In this session, you'll learn how to"
6,Part 1: Understanding Dynamic Time Warping 20 Part 2: Using Dynamic Time Warping and MLflow to Detect Sales Trends 26 CHAPTER 5:,"Chunk 6: In this series, we look at some of the"
7,"Detecting Financial Fraud at Scale With Decision Trees and MLflow on Databricks 34 CHAPTER 6: Fine-Grained Time Series Forecasting at Scale With Prophet and Apache Spark"" 45","Chunk 7: In our series of papers on artificial intelligence, we look"
8,CHAPTER 7: Applying Image Classification With PyTorch Lightning on Databricks 52 CHAPTER 8: Processing Geospatial Data at Scale With Databricks,Chunk 8: Researchers at the Massachusetts Institute of Technology (MIT)
9,63 CHAPTER 9: Exploring Twitter Sentiment and Crypto Price Correlation Using Databricks 77 CHAPTER 10:,Chunk 9: BBC News takes a look back at some of the
10,Customer Case Studies 86 databricks EBOOK: BIG BOOK OF MACHINE LEARNING USE CASES 2ND EDITION 3,Chunk 10: BBC News takes a look at some of the key
11,"CHAPTER 1: Introduction Organizations across many industries are using machine learning to power new customer experiences, optimize business processes and improve employee productivity. From detecting financial fraud to improving the","Chunk 11: In our series of letters from African journalists, film-maker and"
12,"play-by-play decision-making for professional sports teams, this book brings together a multitude of practical use cases to get you started on your machine learning journey. The collection also serves as a guide - including code samples and notebooks - SO you can roll up your sleeves and dive into machine learning on the Databricks Lakehouse.","Chunk 12: If you want to learn how to use machine learning to make better decisions, then this is the book for you."
13,databricks EBOOK: BIG BOOK OF MACHINE LEARNING USE CASES 2ND EDITION 4 CHAPTER 2: Moneyball 2.0:,Chunk 13: BBC News NI looks at some of the key stories
14,"Introduction Improving Pitch-by-Pitch The Oakland Athletics baseball team in 2002 used data analysis and quantitative modeling to identify Decision-Making With undervalued players and create a competitive lineup on a limited budget. The book ""Moneyball,"" written",Chunk 14: This lecture is part of a series on the intersection of economics and sport.
15,"MLB's Statcast Data by Michael Lewis, highlighted the A's '02 season and gave an inside glimpse into how unique the team's strategic data modeling was for its time. Fast-forward 20 years - the use of data science and quantitative modeling is now a common practice among all sports franchises and plays a critical role in scouting, roster construction, game-day operations and season planning.","Chunk 15: In 1998, the Oakland Athletics became the first team in Major League Baseball to use data science in a major way."
16,KEY PlayerTacking PachtoPweTading PowerCable 110V,Chunk 16: BBC Sport takes a look back at some of the
17,FbreCable -r dvidual Supply Tecr nov 0 By Max Wittenberg,Chunk 17: BBC News NI takes a look at some of the
18,1oV nev Core S noV 1,Chunk 18: BBC Sport takes a look at some of the key
19,"Figure 1: Position and scope of Hawkeye cameras at ab baseball stadium databricks EBOOK: BIG BOOK OF MACHINE LEARNING USE CASES 2ND EDITION In 2015, Major League Baseball (MLB) introduced Statcast, a set of cameras and teams are now able to make decisions that influence the outcome of the game,","Chunk 19: Major League Baseball (MLB) is the world's most popular sport, with more than 300 million fans tuning in"
20,"radar systems installed in all 30 MLB stadiums. Statcast generates up to seven pitch by pitch. It's been 20 seasons since the A's first introduced the use of data terabytes of data during a game, capturing every imaginable data point and modeling to baseball. Here's an inside look at how professional baseball teams metric related to pitching, hitting, running and fielding, which the system collects",Chunk 20: The Oakland Athletics are the first team in Major League Baseball to use a pitch-by-pitch tracking system called Statcast.
21,"use technologies like Databricks to create the modern-day ""Moneyball"" and gain and organizes for consumption. This explosion of data has created opportunities competitive advantages that data teams provide to coaches and players on to analyze the game in real time, and with the application of machine learning, the field.",Chunk 21: Major League Baseball (MLB) has become the most data-intensive sport in the world.
22,"2020-09- T00,00.00.000-0000 2020-09- :0 0000 2020-09- BT00:00:00 +0000 2020-09- 0000",Chunk 22: BBC Sport takes a look back at some of the
23,"2020-09- TO0:00:0 2020.09-1 18T00:00:00.000 0-0000 AROAISTDAOAOAONOAN 1.8 2020-09- 18100.0000.000-0000 39.7 SI 2020-09-1 18100,00.00.000-0000 9.8",Chunk 23: Greek Prime Minister Alexis Tsipras says he will seek a
24,578428 35411 FF EARGAHISTDARAOAROAGQON A Figure 3: Sample of data collected by Statcast 6,Chunk 24: Norway's unemployment rate has fallen to its lowest
25,. A3 Figure 2: Numbers represent events during a play captured by Statcast databricks EBOOK: BIG BOOK OF MACHINE LEARNIN G USE CASES 2ND EDITION,Chunk 25: BBC Sport looks at the key statistics behind England'
26,"6 Background Data teams need to be faster than ever to provide analytics to coaches and 23 seconds, and this window of time represents a benchmark from which players SO they can make decisions as the game unfolds. The decisions made from",Chunk 26: BBC Sport takes a look at some of the key takeaways from this year's Rugby World Cup
27,Statcast data can be ingested and processed for coaches to use to make real-time analytics can dramatically change the outcome of a game and a team's decisions that can impact the outcome of the game. season. One of the more memorable examples of this was in game six of the 2020 2. Real-Time Analytics: Another competitive advantage for teams is the,Chunk 27: Real-time analytics is a competitive advantage for teams.
28,"World Series. The Tampa Bay Rays were leading the Los Angeles Dodgers 1-0 in creation of insights from their machine learning models in real time. the sixth inning when Rays pitcher Blake Snell was pulled from the mound while An example of this is knowing when to substitute out a pitcher from fatigue, pitching arguably one of the best games of his career, a decision head coach Kevin",Chunk 28: One of the most remarkable moments of this year's World Series came in the sixth inning.
29,"where a model interprets pitcher movement and data points created Cash said was made with the insights from their data analytics. The Rays went on from the pitch itself and is able to forecast deterioration of performance to lose the game and World Series. Hindsight is always 20-20, but it goes to show pitch by pitch.",Chunk 29: Tampa Bay Rays manager Kevin Cash spoke to the media on Monday about the team's use of artificial intelligence.
30,"how impactful data has become to the game. Coaching staff task their data teams with assisting them in making critical decisions - for example, should a pitcher 3. Ease of Use: Analytics teams run into problems ingesting the volumes of throw another inning or make a substitution to avoid a potential injury? Does a data Statcast produces when running data pipelines on their local computers.",Chunk 30: What are the main challenges faced by Major League Baseball's analytics teams?
31,"player have a greater probability of success stealing from first to second base, This gets even more complicated when trying to scale their pipelines to or from second to third? capture minor league data and integrate with other technologies. Teams want a collaborative, scalable analytics platform that automates data ingestion","Chunk 31: When it comes to stealing bases, baseball teams have a lot of data to work with."
32,"I have had the opportunity to work with many MLB franchises and discuss what with performance, creating the ability to impact in-game decision-making. their priorities and challenges are related to data analytics. Typically, I hear three recurring themes their data teams are focused on that have the most value in Baseball teams using Databricks have developed solutions for these priorities",Chunk 32: Major League Baseball is one of the most competitive sports in the world.
33,"helping set their team up for success on the field: and several others. They have shaped what the modern-day version of ""Moneyball"" looks like. What follows is their successful framework explained 1. Speed: Since every MLB team has access to the Statcast data during a game, in an easy-to-understand way.",Chunk 33: The Boston Red Sox are the first team in Major League Baseball to win 100 games in each of the last three seasons
34,one way to create a competitive advantage is to ingest and process the data faster than your opponent. The average length of time between pitches is databricks EBOOK: BIG BOOK OF MACHINE LEARNIN G USE CASES 2ND EDITION Getting the data,Chunk 34: Big data analytics is the art and science of gathering and analysing vast amounts of data.
35,"When a pitcher throws a baseball, Hawkeye cameras collect the data and save it collected and processed. Just as a waiter can quickly become overworked to an application that teams are able to access using an application programming fulfilling customers' needs, making continuous API requests for data creates some interface (API) owned by MLB. You can think of an API as an intermediate challenges in data pipelines. With the assistance from these data teams, however,",Chunk 35: Major League Baseball's (MLB) Hawkeye camera system is one of the most advanced in the game.
36,"connection between two computers to exchange information. The way this works we have created code to accommodate continuously collecting Statcast data is: a user sends a request to an API, the API confirms that the user has permission during a game. You can see an example of the code using a test API below. to access the data and then sends back the requested data for the user to",Chunk 36: We have created an API to allow you to access Statcast data during a game.
37,"consume. To use a restaurant as an analogy - a customer tells a waiter what they from pathlib import Path import json want to eat, the waiter informs the kitchen what the customer wants to eat, the waiter serves the food to the customer. The waiter in this scenario is the API.",Chunk 37: The API is a way for an application to communicate with another application.
38,"class def sports_api: init_(self, endpoint, api_key) : self.endpoint = endpoint self.api_key = api_key self.connection = self.endpoint + self.api_key API",Chunk 38: class def sports_api: init_(
39,"User Application def fetch_payload (self, request_ L, request_2, adls_path) url = Flaaif.comnectionlsse d= (reques 1(request_2)-",Chunk 39: The following example shows how to fetch adls
40,"Request Request 99.M"" r = requests. get (url) Response",Chunk 40: The following is a list of all the requests made
41,"Response json_data - r.json () now = time. .strftime CaYamid-HR.MIS? file_name = f'json_data_out, (now)"" file_path = Path (""dbfs:/"") Path (adls_path) / Path (file_name)",Chunk 41: The following lines from the CaYamid-HR
42,"dbutils.fs.put (str (file_path), json.dumps (json_data), True) Figure 4: Example of how an API works, using a restaurant analogy return str (file_path) Figure 5: Interacting with an API to retrieve and save data This simple method of retrieving data is called a ""batch"" style of data collection",Chunk 42: How do you use an API to retrieve and save data?
43,"and processing, where data is gathered and processed once. As noted earlier, This code decouples the steps of getting data from the API and transforming however, data is typically available through the API every 23 seconds (the average it into usable information, which in the past, we have seen, can cause latency time between pitches). This means data teams need to make continuous requests in data pipelines. Using this code, the Statcast data is saved as a file to cloud","Chunk 43: This code decouples the steps of getting data from the API and transforming it into usable information, which in the past, we have seen, can cause latency time between pitches."
44,"to the API in a method known as ""streaming"" where data is continuously storage automatically and efficiently. The next step is to ingest it for processing. databricks EBOOK: BIG BOOK OF MACHINE LEARNING USE CASES 2ND EDITION 8",Chunk 44: A new way of storing data has been developed by Google for its Android operating system.
45,"Automatically load data with Auto Loader As pitch and play data is continuously saved to cloud storage, it can be ingested automatically using a Databricks feature called Auto Loader. Auto Loader scans CSV JSON",Chunk 45: Databricks has released a new version of its award-winning pitch and
46,"files in the location they are saved in cloud storage and loads the data into A C D ""Employee"": [ ID Gender City Monthly.",Chunk 46: The BBC's technology team looks at some of
47,Databricks where data teams begin to transform it for their analytics. Auto Loader 2 ID000002(Female Delhi 20000 3 ID000004E Male Mumbai 35000 t is easy to use and incredibly reliable when scaling to ingest larger volumes of data,Chunk 47: Autobrick 20000 3 ID4E Male Mumbai 35000 t is a high
48,"4 ID000007H Male Panchkula 22500 5 ID0000081Male Saharsa 35000 ""id"":""1"", in batch and streaming scenarios. In other words, Auto Loader works just as well 6 ID0000091N Male Bengaluru 100000",Chunk 48: Here's a look at some of the key words that
49,"7 ID000010KMale Bengaluru 45000 for small and large data sizes in batch and streaming scenarios. The Python code 8 ID000011LF Female Sindhudui 70000 ""Name"": ""Ankit"", 9 ID000012NN Male Bengaluru 20000",Chunk 49: Python code 8 ID000011LF Female Sindhudui 70000 for
50,"below shows how to use Auto Loader for streaming data. 10 ID000013NMale Kochi 75000 ""Sal"": ""1000"", 11 1D000014CFemale Mumbai 30000 12 ID000016CMale Mumbai 25000",Chunk 50: You can watch INRDeals INRDeals INRDeals INRDeals INRDeals INRDeals INRDeals
51,"df = spark.readtream. format (""cloudFiles"") I 3 1D000018SFemale Surat 25000 ), f option (,) 14 ID000019TF Female Pune 24000",Chunk 51: df = spark.readtream.
52,"schema () I 15 ID000021VMale Bhubanes 27000 ID000022VFemale Howrah 28000 ""id"":""2"", .load()","Chunk 52: Images courtesy of AFP, EPA, Getty Images and"
53,"""Name"": ""Faizv"". df.writestream. format (""delta"") I option rehechpointlocation? ) Figure 7: Comparison of CSV and JSON formats trigger () 1",Chunk 53: Figure 7: Comparison of two different file formats.
54,".start () It should be obvious which of these two formats data teams prefer to work Figure 6: Setup of Auto Loader to stream data with. The goal then is to load Statcast data in the JSON format and transform it into the friendlier CSV format. To do this, we can use the semi-structured data",Chunk 54: In this article we are going to look at how to load and stream Statcast data.
55,"One challenge in this process is working with the file format in which the Statcast support available in Databricks, where basic syntax allows us to extract and is saved, a format called JSON. We are typically privileged to work with data that is transform the nested data you see in the JSON format to the structured CSV style already in a structured format, such as the CSV file type, where data is organized format. Combining the functionality of Auto Loader and the simplicity of semi-",Chunk 55: In this article we are going to look at how we can use the Auto Loader feature in Datas to transform data into a structured format.
56,"in columns and rows. The JSON format organizes data into arrays and despite its structured data support creates a powerful data ingestion method that makes the wide use and adoption, I still find it difficult to work with, especially in large sizes. transformation of JSON data easy. Here's a comparison of data saved in a CSV format and a JSON format.",Chunk 56: I'm a big fan of the SQL Server hibernate format.
57,databricks EBOOK: BIG BOOK OF MACHINE LEARNING USE CASES 2ND EDITION 9 Using Databricks' semi-structured data support with Auto Loader Auto Loader writing data to a Delta table as a stream,Chunk 57: This paper describes the use of Autobricks in the development of
58,"spark.readstream. format (""cloudFiles"" I # Define the schema and the input, checkpoint, and output pai ths. .option reloudflles.format, ""json"") 1 read_schema = (""id int, .option ""cloudriles.schematocation"", 1",Chunk 58: The spark.readstream library provides a way to stream
59,"""firstName string, .load ("""") I ""middleName string, .selectExpr ""lastName string, +","Chunk 59: string ""firstName string, .load ("""
60,"""gender string, + ""tags:page.name"", # extracts (""tags"": ""page"": ""name' 113 ""birthDate timestamp, ""taga-page.idtint"", # extracts tagaraCpagercian 133 and ""ssn string,","Chunk 60: extract ""tagaraCpagercian 133"""
61,"casts to int ""salary int"") ""tagsieventrype"" # extracts tagarteventrype? 13 json_read.path = /FileStore/streaming-uploads/people-10m' checkpoint_path - /mt/delta/people-10n/checepoints",Chunk 61: BBC Sport takes a look back at some of the
62,"save_path = me/daltapeople-o people_stream (spark I readStream I As the data is loaded in, we save it to a Delta table to start working with it further. .schema (read_schema) I",Chunk 62: The following code shows how to load data into a Delta table from
63,".option Charleaerrigger, 1) I Delta Lake is an open format storage layer that brings reliability, security and .option (""multiline', True) performance to a data lake for both streaming and batch processing and is the -json Gson_read.path))","Chunk 63: .option Charleaerrigger, 1) I Delta Lake is an open format"
64,"foundation of a cost-effective, highly scalable data platform. Semi-structured people_stream."" writeStream I support with Delta allows you to retain some of the nested data if needed. The .format( ('delta') I outputMode ('append') I","Chunk 64: Delta is an open-source, declarative data management platform."
65,"syntax allows flexibility to maintain nested data objects as a column within a Delta option checkpointlocation, checkpoint_path) I table without the need to flatten out all of the JSON data. Baseball analytics teams .start (save_path) use Delta to version Statcast data and enforce specific needs to run their analytics","Chunk 65: syntax allows flexibility to maintain nested data objects as a column within a Delta option checkpointlocation, checkpoint_path)"
66,"on while organizing it in a friendly structured format. With Auto Loader continuously streaming in data after each pitch, semi-structured data support transforming it into a consumable format, and Delta Lake organizing it for use, data teams are now ready to build analytics that gives their team the competitive edge on the field.",Chunk 66: Delta Lake is a game-changing data management platform for youth baseball.
67,databricks EBOOK: BIG BOOK OF MACHINE LEARNING USE CASES 2ND EDITION 10 Machine learning for insights Recall the Rays pulling Blake Snell from the mound during the World Series = that,Chunk 67: BBC Sport takes a look at some of the key stories from the
68,"Machine learning models are relatively easy to build and use, but data teams often decision came from insights coaches saw in their predictive models. Statistical struggle to implement them into streaming use cases. Add in the complexity of analysis of Snell's historical Statcast data provided by Billy Heylen of sportingnews. how models are managed and stored and machine learning can quickly become com indicated Snell had not pitched more than six innings since July 2019, had a",Chunk 68: How do you use machine learning to predict the performance of a pitcher?
69,"out of reach. Fortunately, data teams use MLflow to manage their machine learning lower probability of striking out a batter when facing them for the third time in a models and implement them into their data pipelines. MLflow is an open source game, and was being relieved by teammate Nick Anderson, whose own pitch data platform for managing the end-to-end machine learning lifecycle and includes","Chunk 69: MLflow is an open source game, and was being relieved by teammate Nick Anderson, whose own pitch data platform for managing the end-to-end"
70,"suggests was one the strongest closers in MLB, with a 0.55 earned run average support for tracking predictive results, a model registry for centralizing models that (ERA) and 0.49 walks and hits per innings pitched (WHIP) during the 19 regular- are in use and others in development, and a serving capability for using models in season games he pitched in 2020. Predictive models analyze data like this in real",Chunk 70: We've been looking at some of the best relievers in Major League Baseball over the past five years.
71,data pipelines. time and provide supporting evidence and recommendations coaches use to make critical decisions. MLflow Tracking MLflow Projects,Chunk 71: MLflow is a cloud-based artificial intelligence (
72,MLflow Models Model Registry Record and query Package data science code Deploy machine learning,Chunk 72: MLflow Models Model Registry Record and query Package data
73,"Store, annotate, discover, experiments: code, data, in a format to reproduce runs models in diverse serving and manage models in a config, and results",Chunk 73: In this talk I will show you how to build
74,on any platform environments central repository Read more Read more,Chunk 74: BBC News takes a look at some of the key
75,Read more Read more Figure 8: MLflow overview databricks EBOOK: BIG BOOK OF MACHINE LEARNING USE CASES 2ND EDITION,Chunk 75: BBC News takes a look at some of the key
76,"11 To implement machine learning algorithms and models to real-time use cases, The outputs a machine learning model creates can then be displayed in a data data teams use the model registry where a model is able to read data sitting in visualization or dashboard and used as printouts or shared on a tablet during a",Chunk 76: Machine learning is a branch of computer science that uses computers to learn from large amounts of data.
77,a Delta table and create predictions that are then used during the game. Here's game. MLB franchises working on Databricks are developing fascinating use cases an example of how to use a machine learning model while data is automatically that are being used during games throughout the season. Predictive models are loaded with Auto Loader:,Chunk 77: If you're a fan of Major League Baseball (MLB) and want to see how data can be used to predict the
78,"proprietary to the individual teams, but here's an actual use case running on Databricks that demonstrates the power of real-time analytics in baseball. Getting a machine learning model from the registry and using it with Auto Loader #get model from the model registry",Chunk 78: We've been hearing a lot lately about the use of machine learning in baseball.
79,"model = mlflow.spark. load_model ( model_uri ""model (moo name ""Production')""? #read data from bronze table as a stream events = spark.readtream I .format (""delta"") I",Chunk 79: #read data from bronze table as a stream events
80,"#.option reloudFies.marilesPerrigger"", 1)1 .schema (schema) I .table Chaseatre7 #pass stream through model model_output model.transform: (events)",Chunk 80: Find out more at www.marilesPerrigg
81,"#write stream to silver delta table events.writestrean I .format (""delta') I .outputMode (""append"") I option('checkpointlocation', ""/tmp/baseball/""? I",Chunk 81: #writeformat to silver delta table events.
82,table Cdefault.baseball.treamsilver? databricks EBOOK: BIG BOOK OF MACHINE LEARNING USE CASES 2ND EDITION 12 Bringing it all together with spin ratios and sticky stuff,Chunk 82: The following table shows the percentage of students who scored
83,"Average adjusted fastball spin rate per season MLB introduced a new rule for the 2021 season meant to discourage pitcher's use 20 21 22 23 24 25 of ""sticky stuff,"" a substance hidden in mitts, belts or hats that when applied to a 2017",Chunk 83: Here's a look back at some of the rules changes made by Major League Baseball over the past
84,"baseball can dramatically increase the spin ratio of a pitch, making it difficult for 2018 batters to hit. The rule suspends for 10 games pitchers discovered using sticky stuff. Coaches on opposing teams have the ability to request an umpire check for 2019",Chunk 84: Umpires will be able to check on sticky stuff on pitchers' arms for the first
85,"the substance if they suspect a pitcher to be using it during a game. Spin ratio is a 2020 data point that is captured by Hawkeye cameras, and with real-time analytics and 2021 machine learning, teams are now able to make justified requests to umpires with",Chunk 85: Umpires will be able to use artificial intelligence to determine if pitchers are using performance-enhancing drugs
