Chunk Number,Original Text Chunk,Summary
130,"des questions à Google, toute contrainte réglementaire sur les données crée néanmoins une problématique. Comme souvent, ceci favorisera les groupes puissants au détriment des start-up. L'IA a besoin de données, espérons que le législateur saura tenir compte de ces aspects avant d'édicter des interdictions. 6. LIMPORTANCE DE LAPPRENTISSAGE",Chunk 130: L'Institut National de la Recherche Scientifique (L'IA) avait 
131,"Le meilleur moteur d'intelligence artificielle n'est rien sans apprentissage. Investir dans un système d'intelligence artificielle signifie en premier lieu avoir des jeux de données permettant de décrire des cas déjà rencontrés. Il y a deux grandes catégories d'apprentissage : l'apprentissage supervisé et lapprentissage non supervisé. Dans le premier cas, l'algorithme est nourri","Chunk 131: Dans cependant, l'Institut National de la Recherche Scientifique (INRP) a déj un"
132,"d'exemples : des bases de données annotées lui sont fournies et le système en déduit le programme qui sera utilisé par la suite. Ce programme pourra s'améliorer continuellement si on lui fournit les résultats de ses décisions. Si une image reconnaît un chien alors qu'il s'agissait d'un chat, le fait de lui indiquer que le résultat est mauvais permet d'améliorer l'algorithme. En revanche, dans","Chunk 132: D'aprs-mme, l'aprs-mme, l'aprs-m"
133,"lapprentissage non supervisé, on cherche à construire un système qui apprend à partir de rien. II est possible d'utiliser des méthodes statistiques pour obtenir des séparations automatiques entre plusieurs groupes, par exemple des images de chiens d'un côté et des images de chats d'un autre. Cet apprentissage non supervisé fait actuellement lobjet d'intenses recherches.",Chunk 133: I est possible d'utiliser des méthodes statistiques pour obtenir desparations automatiques
134,"La grande rupture de 2011 a permis l'essor de l'apprentissage profond (deep learning). C'est le début de cette nouvelle classe de réseaux de neurones qui permet de faire des systèmes de reconnaissance d'image, de parole, de vidéo, bien plus puissants que ce qui avait été conçu jusqu'à cette époque, et ce grâce à de gigantesques bases de données.",Chunk 134: C'est tre l'étranger de l'Institut National de la Recherche Scientifique (INR
135,"L'Intelligence Artificielle a un autre objectif : nous permettre de résoudre des problèmes ou de prendre des décisions, même au niveau individuel. La voiture autonome possède la carte. routière dans sa mémoire, a accès aux: informations de trafic. Elle les croise avec les informations qu'elle tire de ses divers capteurs, 24",Chunk 135: L'Intelligence Artificielle a un autre objectif : nous permettre de rés
136,"et doit prendre en permanence des décisions sur la conduite à tenir. Comme le robot qui fait un salto arrière possède des algorithmes neuronaux qui interprètent ses capteurs en permanence, et en déduit les actions à mener sur ses moteurs. Salto arrière d'un robot",Chunk 136: Salto arrire d'un robot arrire d'un brillant
137,"Source: :What's New, Atlas? Boston Dynamics Iimps/wmgpunubecomhaehA-RPoin4, Pour arriver à ces résultats, lalgorithme a dû passer par une phase d'apprentissage, qui n'est jamais vraiment terminée. Ily a trois grandes époques de l'intelligence artificielle. Le graphique 5 l'illustre bien : la machine commence à jouer aux échecs, lapprentissage lui permet de",Chunk 137: Le graphique 5 l'illustre bien : la machine commence  jouer aux éche
138,"faire la distinction entre spam et courriel normal, et lapprentissage profond lui permet de dire qu'une image contient un chat. Graphique 5: Les trois niveaux de l'intelligence artificielle INTELLIGENCE ARTIFICIELLE",Chunk 138: Les trois de l'intelligence artificielle INTELLIG
139,Lintelligence artificielle LAPPRENTISSAGE suscitel Tenthousiasme Lapprentissage commence àslépanouir,Chunk 139: Lintelligence artificielle LAPPRENTISSAGE
140,LAPPRENTISSAGE PROFOND Lapprentissage profond aboutit à des percées quir mènent au boom de TIA,Chunk 140: LAPPRENTISSAGE PROFOND Lapprent
141,"1950's 1960's 1970's 1980's 1990's 2000's 2010's Depuis les débuts optimistes dans les années 1950, de plus petits sous-ensembles de l'intelligence artificielle = en premier lieu, l'apprentissage, puis l'apprentissage profond, un sous- ensemble de l'apprentissage - ont créé des perturbations de plus en plus grandes.",Chunk 141: De plus petits sous-ensembles de l'intelligence artificielle - ont
142,"Source: Michael Copeland, < What's the Difference Between Artificial Intelligence, Machine Learning, and Deep Learning? >, nvidia.com, 29 juillet 2016 blogs.nvida.com/biog/2016/07/29 whats-diference-artica-nteligence-mchineleamingdeep.leamingav) 25 Il faut néanmoins considérer le fait que l'intelligence artificielle n'est pas que la",Chunk 142: What's Between Artificial Intelligence and Deep Machine Learning?
143,"reconnaissance des formes.À lire le Web, on pourrait penser que les réseaux de neurones sont la solution ultime à tous les problèmes. C'est de fait un excellent paradigme lorsque le contexte est mathématisable. Le robot qui fait un salto arrière, le jeu d'échecs ou la reconnaissance de visage sont des catégories de problèmes scientifiques. Pour l'instant, les sciences dures ont dominé les",Chunk 143: A l'Institut National de la Recherche Scientifique (INR) et l'Institut National de la Recherche Scientifique (
144,"sciences molles, surtout dans tout ce qui est modélisable rationnellement. La question est finalement de savoir quels sont les domaines de la vie courante qui ne seront jamais mathématisables.. 7. LES GRANDS ACTEURS DE LINTELLIGENCE ARTIFICIELLE Google, Apple, Facebook et Amazon ne pouvaient pas ne pas s'investir","Chunk 144: Les sciences molles, surtout dans tout ce qui est modélisable rationnelle"
145,"fortement dans l'intelligence artificielle alors qu'ils possèdent des données en énorme quantité. En voici quelques exemples. a) Google Google, très impliqué dans l'intelligence artificielle, procède habituellement par rachat. En 2014, Google a acheté la société anglaise DeepMind, qui","Chunk 145: Une soci anglaise DeepMind, Google's artificial intelligence unit,"
146,"avait développé des réseaux de neurones pour jouer aux jeux vidéo. Mais lobjectif avoué de DeepMind est actuellement de << comprendre ce qu'est l'intelligence >. DeepMind est célèbre pour son programme AlphaGo, qui a battu le champion du monde de go. En octobre 2017,le programme a franchi une étape supplémentaire : en jouant contre lui-même, non seulement son","Chunk 146: DeepMind, the artificial intelligence company run by Google's self-proclaimed ""chief scientist"" Alan Turing, avait "
147,"apprentissage a été plus court, mais surtout il est devenu plus fort que la version précédente22. Nous avons ici un premier exemple d'apprentissage non supervisé, facilité par le fait que le contexte, à savoir les règles du jeu de go, est parfaitement mathématisable. Google a aussi son propre moteur de recommandation nommé Google Home, un haut-parleur et un assistant vocal",Chunk 147: L'apprentissage Google Home s'est déj un haut-parleur de recommandation nommé
148,"disponible en trois versions différentes. b) Amazon Amazon utilise del l'intelligence. artificielle dans son moteur de recommandation, nommé Echo, et dans ses assistants basés sur son système de reconnaissance 22. Voir << AlphaGoZero: Learning from scratch >, dspmindcmebgaphapimplamigscatew",Chunk 148: a) Google use artificial intelligence (AI) to train its self-driving cars.
149,"26 vocale, Alexa, disponible en sept versions différentes. Via son offre de services dans le cloud, Amazon propose également des services fondés sur l'intelligence artificielle, comme la reconnaissance de la parole ou des robots de discussion, les fameux chatbot?3.",Chunk 149: Amazon has announced a new voice-activated assistant for its Echo smart speaker.
150,"c) Facebook Facebook est un énorme utilisateur d'intelligence artificielle. Il choisit les messages qu'ila afficheen utilisant un moteur der typer moteur derecommandation. Récemment, Facebook a mis en place un moteur d'intelligence artificielle pour détecter les tendances suicidaires 24. Comme le dit Joaquin Candela, directeur",Chunk 150: c) Facebook Facebook est un énorme utilisateur d'intelligence artificielle.
151,"du département d'intelligence artificielle appliquée, < Facebook n'existerait pas sans intelligence artificielle25 >. d) Apple Apple investit énormément dans l'intelligence artificielle et propose même un blog où sont expliquées ses recherches26. Siri en est lexpression la plus",Chunk 151: Facebook n'existerait pas sans intelligence artificielle25
152,"évidente : ce système de reconnaissance de la parole très performant utilise des réseaux de neurones de dernière génération qui permettent de comprendre des commandes même dans des environnements très bruyants, comme dans la rue. Apple va également bientôt lancer son propre moteur de recommandation, nommé HomePod, un haut-parleur connecté avec Apple Music.",Chunk 152: Anniversaire de l'Institut National de la Recherche Scientifique (INRC) avait 
153,"e) IBM IBM a créé Watson, un système d'intelligence artificielle pour jouer, à ses débuts, au jeu Jeopardy, léquivalent américain de l'émission française Questions pour un champion. Watson a analysé 200 millions de pages?7 pour finalement battre les anciens champions et ainsi gagner le premier prix. Maintenant, Watson est","Chunk 153: C'est--dire, c'est--dire, c'est-"
154,"proposé par IBM dans d'autres domaines, comme la médecine ou le droit. IBM présente aussi un blog sur le sujet de l'intelligence artificielle 28. La question majeure est le degré d'ouverture de ces systèmes. IBM propose 23.Voir < Apprentissage machine sur AWS >: awsamazon.com/f/machineleaming. 24. Voir Sam Shead, < Facebook is using artificial intelligence to spot suicidal tendencies in its users >,",Chunk 154: IBM sente aussi un blog sur le sujet de l'intelligence artificielle.
155,"businessinsidercom, 28 novembre 2017 wwwbusinesinsidercom/achokisusinga-tospotsucda- tendencies-201711). 25. < Facebook today cannot exist without Al > (Steven Levy, <l Inside Facebook's Al machine > wired.com, 23 septembre 2017, ""mMdom2tV/t2msaeacholsaimsdine, 26. Voir & Apple Machine Learning. Journal > machnetamngape.com.",Chunk 155: Here's a guide to some of the most important technology stories of the past
156,"27. Voir <. Jeopardy, The IBM Challenge. About IBM Watson Fact Sheet > ibm.com m/bmonmeptman. power/news/pdf/BM Watson FactSheetpdf). 28. Voir << Built with Watson, Stories of how Watson and Al are transforming our world >, ibm.com www.ibm.com/ blogs/watson/). 27","Chunk 156: Voir  Built with Watson, Stories of how Watson and Al are transforming our"
157,"des interfaces de programmation à Watson qui sont ouvertes 29, tout comme Amazon propose des interfaces sur son système d'apprentissage profond30. Donc tout le monde peut, à peu de frais, se connecter à ces systèmes et en bénéficier. Facebook, en revanche, ne partage pas la plupart de ses recherches, ne propose pas encore d'interfaces de programmation permettant","Chunk 157: Amazon, Facebook, Google, Microsoft, Apple, IBM, Intel, Twitter, Tizen, Tizen-O, Tizen-B,"
158,"de les utiliser3l, mais a récemment mis en accès libre son environnement d'apprentissage, Caffe232. Cette apparente simplicité de connexion n'est pas suffisante :il faut insister sur le fait que ce ne sont pas les algorithmes qui détiennent la valeur principale, mais les données d'apprentissage. Ces systèmes d'intelligence artificielle sont",Chunk 158: Cet suffisante :il faut suffisante :il faut
159,"d'autant plus performants qu'ils sont contextualisés et ont donc besoin de données ciblées pour profiter d'un apprentissage efficace. En 1988, le chercheur en informatique indien Raj Reddy définissait ainsi les grands challenges de l'intelligence artificielle : le téléphone qui traduit (en cours de développement), le champion de jeu d'échecs (réalisé), la résolution",Chunk 159: Une chercheur ont t t t t t 
160,"de théorèmes mathématiques (certains théorèmes le sont déjà), les voitures autonomes (réalisé), les systèmes auto-organisants (en cours) et les systèmes autorépliquants (en cours)33. 8. L'IMPACT SUR LES MÉTIERS Lintelligence artificielle est-elle une menace pour les professions, notamment","Chunk 160: L'intelligence artificielle est-elle une menace pour les professions, not"
161,"pour les professions intellectuelles ? Une des réponses les plus argumentées a été fournie par Richard et Daniel Susskind 34, qui ont analysé l'impact du numérique sur nombre de professions, dont celles de médecins, avocat, enseignant, architecte, comptable, et même celles du clergé. Six menaces semblent peser sur les professions intellectuelles :",Chunk 161: What is the impact of professions on society ?
162,"-la première est économique : les prix des experts sont très élevés et sont donc inaccessibles au plus grand nombre ; 29.Voir < Build on the Al platform business >, ibm.com hnwdrye. 30. Voir < Machine learning int the hands of every developer and data scientist > amazon.com (aws.amazon.com/ machine-learning).",Chunk 162: La premire fois ont t  l'occasion de l'aujourd'
163,"31.Voir < Facebook Al Research (FAIR) >, fb.com ecNBsoNaipyheokaresatha, 32. Voir < Caffe2,Ar new lightweight, modular, and scalable deep learning framework: >, fb.com (research.fb.com/ downloads/caffe2). 33. Voir Raj Reddy, & Foundations and Grand Challenges of Artificial Intelligence >, Al Magazine, vol. 9, n"" 4, hiver 1988, p. 9-21 wyepPpiNms-twsna,","Chunk 163: Facebook has launched a new deep learning framework, Caffe2, which it says will ""revolutionise the way we train"
164,"34. Voir Richard et Daniel Susskind, The Future of Professions. How technology will transform the work of Human Experts, Oxford University Press, 2015. 28 - la deuxième est technologique : les professions reposent encore sur des méthodes et des outils du passé, et n'utilisent pas assez les technologies","Chunk 164: Voir Richard et Daniel Susskind, The Future of Professions."
165,"modernes ; = la troisième est psychologique : les professionnels n'autorisent pas assez lautorésolution des problèmes par les clients eux-mêmes, en refusant de partager leur savoir ; - la quatrième est d'ordre moral et est une conséquence des menaces",Chunk 165: La troisime psychologique : les professionnels n'auto
166,"précédentes : les professionnels, indispensables à la société et pourtant inaccessibles, voient leur image se dégrader; - la cinquième est qualitative : la qualité des services n'est plus au rendez- vous, excepté parmi la classe supérieure des quelques experts mondialement reconnus ;",Chunk 166: La cinquime de l'un des quelques experts ont 
167,"-la sixième menace est lopacité des professionnels, qui refusent souvent d'être évalués et préfèrent entretenir une couche de mystère autour de leurs réelles compétences. Ce sévère constat explique pourquoi l'intelligence artificielle représente un véritable challenge pour les professionnels. Les systèmes d'intelligence",Chunk 167: C'est tre d'un tre mme 
168,"artificielle apportent des solutions à chacun de ces problèmes. Ils sont de moins en moins chers, à la pointe de la technologie ; de plus en plus accessibles, ils autorisent lapprentissage, ils sont plus performants que beaucoup d'experts et ils peuvent être transparents. Comme l'analyse Idriss Aberkane, nous résoudrons les graves problèmes","Chunk 168: Une tte  l'occasion d'un nouveau tte  Dakar, Senegal"
169,qui pèsent sur notre planète par le développement de léconomie de la connaissances. Or celle-ci ne peut pas fonctionner si la connaissance reste une rareté. Le grand challenge des < cols blancs > d'aujourd'hui est de passer à une économie d'abondance pour ce qui concerne l'expertise. C' est justement ce que l'intelligence artificielle est en train de permettre. Il ne reste plus aux,Chunk 169: L'intelligence artificielle est en train de permettre. C' est justement ce que l'intelligence artificielle est
170,"professionnels qu'à entreprendre le douloureux travail de remise en cause de leurs processus et de leurs méthodes pour tirer parti de la technologie. Ce ne sera pas la première fois dans l'histoire de lhumanité. 35. Idriss J.Aberkane, Economie de la connaissance, Fondation pour l'innovation politique, mai 2015 ww.fomapalogetude/alisataresmmemiedelacommaisancel,",Chunk 170: La premire fois dans l'histoire de lhumanité peut-on t
171,29 9. LA MÉDECINE La médecine française est basée sur une tradition hippocratique de soins a posteriori. La prévention n'est pas dans les gènes de lécole de médecine. Or c'est justement dans le domaine de la prévision que les plus grands progrès,Chunk 171: La médecine franaise n'est pas dans les gnes de 
172,"ont été effectués grâce à l'intelligence artificielle, avec surtout une grande disruption, les techniques génomiques. Le séquençage génomique a vu son coût passer de 100 millions de dollars à moins de 100 dollars entre 2001 et 2017 (voir graphique 6). C'est beaucoup mieux que la loi de Moore sur les microprocesseurs.","Chunk 172: Michael Moore,  l'Institut National de la Recherche Scientifique (INR), s'"
173,Graphique 6: Évolution du coût du séquençage génomique Cost per Genome $100M $10M Mooreislaw,Chunk 173: Researchers at the Massachusetts Institute of Technology (MIT)
174,$1M $100K $10K NIH) National Human Genome Researchl Institute genome. gowisequencngcosts,Chunk 174: Scientists say they have figured out how much it will
175,$1K T - - - - - - TTTTTT 2001 2002 2003 2004 2005 2006 2007 2008 2009 2010 2011 2012 2013 2014 2015,Chunk 175:     
176,"Source : National Human Genome Research Institute www.genomegow/sequencingcosts), Aux États-Unis, la société 23andMe propose votre séquençage ADN pour la modique somme de 99 dollars si vous souhaitez juste savoir qui sont voS ancêtres, et de 199 dollars si vous voulez savoir quelles sont les maladies génétiques dont vous êtes porteur 36. Ce séquençage génétique devient",Chunk 176: Cegenomequenage génétique devient les maladies génétiques dont vous voulez savoir quelles
177,"surtout utile lorsqu'il est croisé avec des bases de données. C'est donc, une fois de plus, dans la constitution de ces bases et leur interprétation par des 36. Poure en savoir plus sur 23andMe, voir le site : www2andmecomven-ny. 30 moteurs d'intelligence artificielle que se situe la valeur. La plus grande base est","Chunk 177: Une fois de plus grande, une fois de plus, dans la constitution de ces bases et leur"
178,"Genbank, qui contient près de 200 millions de séquences ADN en accès libre (voir graphique 7). Graphique 7: Evolution du nombre de données de séquences d'ADN Notre compréhension de la base génétique de la vie (et de nombreuses maladies) a explosé au cours des dernières années - tout comme la quantité de données connexes.","Chunk 178: Genbank, qui contient prs de 200 millions dequences ADN en accs libre, a"
179,200 MILLIONS 187 MILLIONS 150 100 NOMBRE DE SÉQUENÇES,Chunk 179: The world's richest people have spent more than
180,D'ADN ENREGISTRÉES DANS LA BASE DE DONNEES 50 GENBANK 62 MILLIONS,Chunk 180: BBC News NI takes a look at some of the
181,2000 2005 2010 2015 Source :N National Center for Biotechnology Information.,Chunk 181: The National Institutes of Health (NIH) has released
182,"Mais iln'y a pas que la génétique qui est bouleversée par l'intelligence artificielle et le big data. Lexemple des radiologues est illustratif. Aux Etats-Unis, il y a chaque année environ 800 millions d'examens radiologiques effectués, générant 60 milliards d'images37, > soit une énorme banque d'informations permettant de faire des diagnostics plus précis. IBM Watson, entre autres, a su","Chunk 182: IBM Watson, s'il y avait  l'arrivée d'un tat de l'"
183,"ainsi mieux que des médecins détecter des cas de pneumonie. Et l'on pourrait multiplier les exemples à l'infini. Les systèmes d'intelligence artificielle dans le monde médical ont accès à des millions de dossiers médicaux et permettent des diagnostics bien plus individualisés que ce qu'un médecin peut faire. Aucun médecin, généraliste ou spécialiste, ne serait en mesure","Chunk 183: Aujourd'hui, l'Institut National de la Recherche Scientifique (INRP) a déj "
184,"d'ingurgiter un tel nombre de données. Pour le cas français, l'intelligence artificielle aura du mal à pénétrer les hopitaux, peu sensibles au numérique au sens traditionnel comme l'ont déjà souligné Nicolas Bouzou et Christophe Marques38. Et si le numérique est en retard dans les hôpitaux, alors quid de IIA intelligence artificielle] ! Sile",Chunk 184: L'Institut National de l'Agriculture et de l'Economie (INEA) avait t
185,"lecteur tape ""intelligence artificielle et hôpitaux"" sur Google, il verra plein de 37. Voir Greg Ip, < How Robots May Make Radiologists' Jobs Easier, Not Redundant >, The Wall Street. Journal, 22 novembre 2017. 38. Nicolas Bouzou et Christophe Marques, Hôpital: libérer linnovation, Fondation pour l'innovation politique, février 2017 lww.fondpalogetude.cbsbauoverchsiseplemagyestgplberer-innovation),","Chunk 185: Voir Greg Ip,  How Robots May Make Radiologists' Jobs Easier, Not Redundant,"
186,"31 têtes de chapitres enthousiastes décrivant comment I'IA va améliorer l'hôpital, mais il va vite se rendre compte que ces articles sont suisses ou belges 39 >. 10. LE FUTUR Une question souvent entendue est la suivante : que reste-t-1l à l'humain que",Chunk 186: Une tte de chapitres enthousiastestescrivant
187,"la machine ne sache pas faire ? Lintuition ? Mais l'intuition n'est-elle pas la qualité indispensable surtout lorsque l'on manque de données ? Dempathie ? Mais l'informatique affective est un des grands sujets de recherche actuellement ; par exemple, le Massachusetts Institute of Technology (MIT) a consacré à ce thème un département entier, sous la direction de Rosalind","Chunk 187: Mais l'informatique de recherche actuellement ; par exemple, le Massachusetts Institute of Technology (MIT"
188,"Picard40. La créativité ? C'est aussi un sujet d'exploration de IBM Watson 41 qui, à la mi-2016, a créé une bande-annonce pour un film d'horreur. Dans un article datant d'octobre 2017,Melba Kurman avance l'idée que cei n'est pas la créativité qui nous distinguera de l'intelligence artificielle, elle-même devenue créative, mais plutôt notre capacité à piloter la créativité des machines*2.","Chunk 188: C'est aussi un sujet d'exploration de IBM Watson 41 qui,  la mi-2016, aé une band"
189,"Cet article permet d'ailleurs d'aborder le grand débat actuel : la singularité. Ce concept, inventé par Ray Kurzweil, part du constat que si l'on poursuit la courbe d'augmentation de la puissance des ordinateurs, vers 2020 nous aurons la capacité de traitement du cerveau humain, et vers 2060 celle de toute l'humanité. De plus, des technologies basées sur la mécanique quantique et",Chunk 189: Une mécanique ordinateur s'enfant  l'équipe de l'équipe
190,"non sur lélectronique ouvriraient la voie à des puissances de calcul qui seraient plus proches de l'exponentiel que du polynomial, ce que sont les ordinateurs actuels. La courbe en serait encore plus vertigineuse (voir graphique 8). 39. Voir < Pourquoi la moitié des hôpitaux vont adopter 'intelligence artificielle d'ici 5 ans >, lespécialiste.be, 18 juillet 2017 (article disponible en accès réservé sur wwwlespecialistebeltfactualtesimedical pourquoi-la-",Chunk 190: Une lélectronique de l'Institut National de la Recherche Scientifique (INRC) avait tre
191,"maiedylypbummyeeheeReamahel. Le lecteur souhaitant approfondir l'impact de l'intelligence artificielle sur la médecine et sur d'autres métiers pourra trouver matière dansl les analyses d'Olivier Ezrattyr présentant une documentation approfondie sur l'intelligence artificiellee en 2017 (voir notamment Olivier, Ezratty, a Les usages de l'intelligence artificielle >, oezratty.net, 19 octobre 2017, www. eatyVmopesAA",Chunk 191: Le lecteur de l'intelligence artificielle sur la médecine et sur d'métier
192,"book/j. 40. Voir affect.media.mitedu/ et web.media.mitedu) - ard/ 41. Voir < The quest of Al creativity > ibm.com Wwww.bm.comwatsonaolanegerepors//futuredfartfica- melgemceacreswynm, 42. Melba Kurman, < The coming creativity explosion belongs to the machines >, singularityhub, 1"" octobre 2017","Chunk 192: The coming creativity explosion belongs to the machines, singularityhub, 1"" octobre 2017"
193,p/smelaybcomAp 10/01/the-coming gcreatinyexplosion-wil-beomgiothe-machines/#sm.01 Oamhiencey2paly.4) 32 Graphique 8: Croissance exponentielle de la puissance de calcul Vingtième à vingt-et-unième siècle,Chunk 193: Graphique 8: Croissance exponentielle de la
194,"10"" Échelle logarithmique 10'5 10*0","Chunk 194: 10"" chelle logarithmique 10'5"
195,"10* $A 10"" 8 10-5 1 a 10",Chunk 195: The winning numbers in Saturday evening's drawing of
196,"Tous les cerveaux humains 105 10 1 a 10""",Chunk 196: Tous les cerveaux humains 105
197,"Un cerveau humain 10"" Un cerveau de souris I 3",Chunk 197: Un cerveau humain 10 Un cerve
198,10 Un cerveau d'insecte a : a 1,"Chunk 198: All photographs  AFP, EPA, Getty Images"
199,"I 10"" 10 -10 1900 1920 1940 1960 1980 2000 2020 2040 2060 2080 2100 Années",Chunk 199: BBC Sport takes a look back at some of the
