Chunk Number,Original Text Chunk,Summary
332,EBOOK: BIG BOOK OF MACHINE LEARNING USE CASES 2ND EDITION 43 Updating the pipeline Review the results Now let's update the ML pipeline and create a new cross validator. Because we are Now let's look at the results of our new confusion matrix. The model misidentified,"Chunk 332: In our series of letters from African journalists, film-maker and columnist Ahmed Rashid looks at some of the"
333,"using ML pipelines, we only need to update it with the new data set and we can only one fraudulent case. Balancing the classes seems to have improved the model. quickly repeat the same pipeline steps. # Re-run the same ML pipeline (including parameters grid) Confusion Matrix (Balanced Test)",Chunk 333: We are running a regression model on a new data set and need to balance the classes in the model.
334,"1200000 crossval_b CrossValidator (estimator = dt, estimatorParamaps - paramGrid, 1050000 evaluator - evaluatorAUC,",Chunk 334: The following is a list of the most frequently used
335,"numFolds = 3) Fraud 50774 1 900000 pipelinecvb = Pipeline (stages-lindexer, va, crossval_b])",Chunk 335: The latest figures from the UK's Serious Fraud
336,"750000 # Train the model using the pipeline, parameter grid, and BinaryClassifcationivaluator using the train_b dataset 600000 CVModel_b - pipelinecv_b.fit (train_b)","Chunk 336: Train the model using the pipeline, parameter grid,"
337,450000 # Build the best model (balanced training and full test datasets) NoF Fraud 488 1220963,Chunk 337: Fraud investigators at the UK's National Crime Agency
338,300000 train_predb CvModel b.transform (train_b) test_predb cwModel_D.transform (test) 150000 # Evaluate the model on the balanced training datasets,Chunk 338: The following table shows the results of the training datasets
339,pr_train_b evaluatorP.evaluate (train_pred.b) Fraud No Fraud auc_train_b evaluatorAvC.evaluate (train_predb) Predicted label,Chunk 339: Fraud No Fraud auc_train_b evaluator
340,"# Evaluate the model on full test datasets pr_test_b evaluatorP.evaluate (test_pred_b) Model feedback and using MLflow auc_test_b = evaluatorAUC.evaluate (test_pred_b) Once a model is chosen for production, we want to continuously collect feedback",Chunk 340: We want to collect feedback on the model selected for production.
341,"# Print out the PR and AUC values to ensure that the model is still the behavior of interest. Since we are print (""PR train:"", pr_train_b) identifying",Chunk 341: # Print out the AUC and PR values for the
342,"print (""AUC train: auc_train_b) starting with a rule-based label, we want to supply future models with verified true print (""PR test:"", pr_test_b) print (""AUC test:"", auc_test_b) labels based on human feedback. This stage is crucial for maintaining confidence",Chunk 342: We are working on a new way to label trains.
343,"and trust in the machine learning process. Since analysts are not able to review # Output: every single case, we want to ensure we are presenting them with carefully chosen # PR train: 0.999629161563572 # AUC train: 0.998071389056655",Chunk 343: We want to make it as easy as possible for you to see how our machine learning
344,"cases to validate the model output. For example, predictions, where the model has # PR test: 0.990470917789063 low are # AUC test: 0.9997903902201509",Chunk 344: The following examples show how to validate the results of
345,"certainty, good candidates for analysts to review. The addition of this type of feedback will ensure the models will continue to improve and evolve with the changing landscape. databricks EBOOK: BIG BOOK OF MACHINE LEARNING USE CASES 2ND EDITION",Chunk 345: Bigbricks has added a new feature to its learning management system (LMS) to
346,"44 4 MLflow helps us throughout this cycle as we train different model versions. Conclusion We can keep track of our experiments, comparing the results of different model configurations and parameters. For example here, we can compare the PR and AUC We have reviewed an example of how to use a rule-based fraud detection",Chunk 346: How to use 44 4 MLflow to train machine learning models How to use 44 4 MLflow to train machine learning models How
347,"of the models trained on balanced and unbalanced data sets using the MLflow UI. label and convert it to a machine learning model using Databricks with MLflow. Data scientists can use MLflow to keep track of the various model metrics and any This approach allows us to build a scalable, modular solution that will help us additional visualizations and artifacts to help make the decision of which model keep up with ever-changing fraudulent behavior patterns. Building a machine","Chunk 347: In this talk, I will show you how to build a machine learning model using MLflow."
348,"should be deployed in production. The data engineers will then be able to easily learning model to identify fraud allows us to create a feedback loop that helps retrieve the chosen model along with the library versions used for training as a jar the model to evolve and identify new potential fraudulent patterns. We have seen file to be deployed on new data in production. Thus, the collaboration between how a decision tree model, in particular, is a great starting point to introduce",Chunk 348: We are looking at how decision trees can be used to identify fraud in data.
349,"the domain experts who review the model results, the data scientists who update machine learning to a fraud detection program due to its interpretability and the models, and the data engineers who deploy the models in production will be excellent accuracy. strengthened throughout this iterative process.",Chunk 349: The fraud detection team is made up of many people.
350,"A major benefit of using the Databricks platform for this effort is that it allows for data scientists, engineers and business users to seamlessly work together wwwyoutupecom/watchveK.459-ki8 throughout the process. Preparing the data, building models, sharing the results wwwyputubecom/atchveBVSyPymiw",Chunk 350: BBC News takes a look at how the BBC is using the Databricks platform to
351,"and putting the models into production can now happen on the same platform, allowing for unprecedented collaboration. This approach builds trust across the previously siloed teams, leading to an effective and dynamic fraud detection program. Try this notebook by signing up for a free trial in just a few minutes and get",Chunk 351: This case study shows how one of the world's largest banks is using artificial intelligence (AI) and machine learning to
352,started creating your own models. databricks EBOOK: BIG BOOK OF MACHINE LEARNING USE CASES 2ND EDITION 45 CHAPTER 6:,Chunk 352: How do you build a 3D model of your
353,Fine-Grained Time Series Advances in time series forecasting are enabling retailers to generate more reliable demand forecasts. The challenge now is to produce these forecasts in a timely manner and at a level of granularity that allows Forecasting at Scale With the business to make precise adjustments to product inventories. Leveraging Apache Spark and Facebook,Chunk 353: This report looks at how Apache Spark and Facebook are enabling retailers to generate more reliable demand forecasts.
354,"Prophet and Apache Spark"" Prophet, more and more enterprises facing these challenges are finding they can overcome the scalability and accuracy limits of past solutions. In this chapter, we'll discuss the importance of time series forecasting, visualize some sample time series data, and then build a simple model to show the use of Facebook Prophet. Once you're comfortable building a single model, we'll combine Facebook Prophet with the magic of Spark to show you how to train hundreds",Chunk 354: Time series forecasting and hundreds training are two of the biggest challenges facing data scientists today.
355,"of models at once, allowing you to create precise forecasts for each individual product-store combination at a level of granularity rarely achieved until now. Accurate and timely forecasting is now more important than ever Improving the speed and accuracy of time series analyses in order to better forecast demand for products and services is critical to retailers' success. If too much product is placed in a store, shelf and storeroom",Chunk 355: Time series forecasting has never been so easy.
356,"space can be strained, products can expire, and retailers may find their financial resources are tied up in By Bilal Obeidat, Bryan Smith inventory, leaving them unable to take advantage of new opportunities generated by manufacturers or shifts and Brenner Heintz in consumer patterns. If too little product is placed in a store, customers may not be able to purchase the",Chunk 356: Too little product in a store can have a negative impact on a retailer's bottom line.
357,"products they need. Not only do these forecast errors result in an immediate loss of revenue to the retailer, Try this time series forecasting but over time consumer frustration may drive customers toward competitors. notebook in Databricks * New expectations require more precise time series forecasting methods and models",Chunk 357: Time series forecasting has become a major problem for retailers.
358,"For some time, enterprise resource planning (ERP) systems and third-party solutions have provided retailers with demand forecasting capabilities based upon simple time series models. But with advances in technology and increased pressure in the sector, many retailers are looking to move beyond the linear models and more traditional algorithms historically available to them. New capabilities, such as those provided by Facebook Prophet, are emerging",Chunk 358: Demand forecasting has become an increasingly important part of the supply chain.
359,"PRGPHET from the data science community, and companies are seeking the flexibility to apply these machine learning models to their time series forecasting needs. databricks EBOOK: BIG BOOK OF MACHINE LEARNING USE CASES 2ND EDITION 46",Chunk 359: We are looking for a Data Scientist to work with our machine learning models to predict
360,"This movement away from traditional forecasting solutions requires retailers and Next, by viewing the same data on a monthly basis, we can see that the year- the like to develop in-house expertise not only in the complexities of demand over-year upward trend doesn't progress steadily each month. Instead, we see a forecasting but also in the efficient distribution of the work required to generate",Chunk 360: In our series of letters from UK business journalists we look at the changing nature of retail forecasting.
361,"clear seasonal pattern of peaks in the summer months and troughs in the winter hundreds of thousands or even millions of ML models in a timely manner. Luckily, months. Using the built-in data visualization feature of Databricks Collaborative we can use Spark to distribute the training of these models, making it possible to Notebooks, we can see the value of our data during each month by mousing",Chunk 361: We use Spark to train ML models for our big data projects.
362,"predict both demand for products and services and the unique demand for each over the chart. product in each location. sale Dec 1,2017 695,170 Visualizing demand seasonality in time series data",Chunk 362: The chart below shows the year-on-year change in demand
363,"1.0M 800k To demonstrate the use of Prophet to generate fine-grained demand forecasts 600k for individual stores and products, we will use a publicly available data set from",Chunk 363: We will use Prophet to generate demand forecasts for individual stores and
364,Kaggle. It consists of 5 years of daily sales data for 50 individual items across 10 2013 2015 MONTH 2017 different stores.,Chunk 364: This is a visualisation of the best-selling items
365,"To get started, let's look at the overall yearly sales trend for all products and stores. At the weekday level, sales peak on Sundays (weekday 0), followed by a hard drop As you can see, total product sales are increasing year over year with no clear sign on Mondays (weekday 1), then steadily recover throughout the rest of the week. of convergence around a plateau. year 30k",Chunk 365: Let's take a look at the seasonality of retail sales.
366,2013 11M 20k 2014 10M,Chunk 366: BBC Sport takes a look back at some of the
367,2015 e 9.5M 10k 2016 2017 9.0M,Chunk 367: BBC Sport takes a look back at some of the
368,8.5M 0.00 8.OM WEEKDAY 3 5,Chunk 368: BBC News NI takes a look at some of the
369,2013 2014 2015 2016 2017,Chunk 369: BBC Sport takes a look back at some of the
370,year databricks EBOOK: BIG BOOK OF MACHINE LEARNING USE CASES 2ND EDITION 47 Getting started with a simple time series forecasting,Chunk 370: BBC News takes a look at some of the key
371,"model on Facebook Prophet As illustrated above, our data shows a clear year-over-year upward trend in sales, Now that we have fit our model to the data, let's use it to build a 90-day forecast. along with both annual and weekly seasonal patterns. It's these overlapping In the code below, we define a data set that includes both historical dates and 90",Chunk 371: Let's take a look at Facebook's latest sales figures.
372,"patterns in the data that Facebook Prophet is designed to address. days beyond, using Prophet's make.ature.Aatafrane method: Facebook Prophet follows the scikit-learn API, SO it should be easy to pick up for future_pd = model.make_future_dataframe ( periods=90,",Chunk 372: In this post I'm going to show you how to use Facebook Prophet to
373,"anyone with experience with sklearn. We need to pass in a two-column pandas freq-'d', DataFrame as input: the first column is the date, and the second is the value to includeMistory-Trve predict (in our case, sales). Once our data is in the proper format, building a model",Chunk 373: I'm trying to build a model to predict the likelihood of a sale happening.
374,"# predict over the dataset is easy: forecast_pd model.predict (future_pd) import pandas as pd That's it! We can now visualize how our actual and predicted data line up, as well as",Chunk 374: Here's how to build a model that predicts the import of
375,"from fbprophet import Prophet a forecast for the future using Prophet's built-in -plot method. As you can see, the # instantiate the model and set parameters weekly and seasonal demand patterns we illustrated earlier are in fact reflected in model = Prophet","Chunk 375: In our series of posts on how to use Prophet, we looked at how to create a forecast"
376,"interval width=0.95, the forecasted results. growth=' linear', alyeaoaltytal, predict_fig - model.plot (forecast_pd, xlabel-'date', ylabel-'sales')",Chunk 376: The following table shows the expected sales growth for the
377,"elysesaltyt, display (fig) ayeaoalityrte, seasonalitymode-'multiplicative # fit the model to historical data",Chunk 377: seasonalitymode'multiplicative # fit the
378,model.fit (history_pd) databricks EBOOK: BIG BOOK OF MACHINE LEARNIN G USE CASES 2ND EDITION 48 This visualization is a bit busy. Bartosz Mikulski,Chunk 378: BBC News takes a look back at some of the
379,"provides an excellent breakdown of it that is 50 well worth checking out. In a nutshell, the black HISTORICAL FORECASTED",Chunk 379: If you've ever wanted to know more about
380,"DATA DATA dots represent our actuals, with the darker 40 blue line representing our predictions and","Chunk 380: BBC Sport tracks all the key stories, stats and"
381,the lighter blue band representing our (95%) uncertainty interval. 30 a 20,Chunk 381: BBC Sport takes a look back at some of the
382,10 0 2017-02 2017-04 2017-06 2017-08 2017-10 2017-12 2018-02 2018-04 date databricks,Chunk 382: BBC News NI takes a look at some of the
383,"EBOOK: BIG BOOK OF MACHINE LEARNING USE CASES 2ND EDITION 49 Training hundreds of time series forecasting models Of course, training models on a cluster of worker nodes (computers) requires more in parallel with Prophet and Spark",Chunk 383: This course is for people who want to learn how to use artificial intelligence (AI
384,"cloud infrastructure, and this comes at a price. But with the easy availability of on-demand cloud resources, companies can quickly provision the resources they Now that we've demonstrated how to build a single model, we can use the power need, train their models and release those resources just as quickly, allowing them of Spark to multiply our efforts. Our goal is to generate not one forecast for the","Chunk 384: We've shown how to use Spark to build a single model, train it and release it just as quickly, allowing them of Spark to multiply our efforts."
385,"to achieve massive scalability without long-term commitments to physical assets. entire data set, but hundreds of models and forecasts for each product-store combination, something that would be incredibly time-consuming to perform as a The key mechanism for achieving distributed data processing in Spark is the sequential operation. DataFrame. By loading the data into a Spark DataFrame, the data is distributed","Chunk 385: In this paper, we describe how we have used Spark to create a distributed data warehouse."
386,"across the workers in the cluster. This allows these workers to process subsets Building models in this way could allow a grocery store chain, for example, to of the data in a parallel manner, reducing the overall amount of time required to create a precise forecast for the amount of milk they should order for their perform our work.","Chunk 386: In our paper, we present a novel way to process large amounts of data: we cluster all of the data in a cluster into a"
387,"Sandusky store that differs from the amount needed in their Cleveland store, based upon the differing demand at those locations. Of course, each worker needs to have access to the subset of data it requires to do its work. By grouping the data on key values, in this case on combinations of store and item, we bring together all the time series data for those key values onto",Chunk 387: This is a great example of how you can use time series data to work out the differences in demand between two stores.
388,"How to use Spark DataFrames to distribute the processing a specific worker node. of time series data store_item history Data scientists frequently tackle the challenge of training large numbers of models groupBy ('store', 'item')",Chunk 388: How to use Spark DataFrames to distribute the processing a specific worker node
389,"using a distributed data processing engine such as Spark. By leveraging a Spark cluster, individual worker nodes in the cluster can train a subset of models in We share the groupBy code here to underscore how it enables us to train parallel with other worker nodes, greatly reducing the overall time required to train many","Chunk 389: In our series of papers on artificial intelligence, we will be looking at how we can reduce the time it takes to train models"
390,"the entire collection of time series models. models in parallel efficiently, although it will not actually come into play until we set up and apply a custom pandas function to our data in the next section. databricks EBOOK: BIG BOOK OF MACHINE LEARNING USE CASES 2ND EDITION",Chunk 390: We are working on a new way to store time series data.
391,"50 Leveraging the power of pandas user-defined functions With our time series data properly grouped by store and item, we now need to def forecaststore.iten (history_pd: pd.DataFrame) -> pd.DataFrame: train a single model for each group. To accomplish this, we can use a pandas","Chunk 391: In this paper, we will look at how pandas can be used to train models for time series data"
392,"# instantiate the model, configure the parameters function, which allows us to apply a custom function to each group of data in our model = Prophet ( DataFrame. interval.width-0.S,",Chunk 392: We are going to create a model of a group of data
393,"growth=' linear', aly,easoalty-ral, This function will not only train a model for each group, but also generate a result ely.sescmaltyt, aryacatyrte,",Chunk 393: This function will train a model for each group of
394,"set representing the predictions from that model. But while the function will train seasonalltymode-""'ntiplicative and predict on each group in the DataFrame independent of the others, the results returned from each group will be conveniently collected into a single resulting # fit the model",Chunk 394: This function will train a seasonalltymode-'ntiplicative model and predict on each group
395,DataFrame. This will allow us to generate store-item level forecasts but present our model.fit (history_pd) results to analysts and managers as a single output data set. # configure predictions future_pd = model.make future_ dataframe (,Chunk 395: The following code is used to create a newFrame for our store-item
396,"periods=90, As you can see in the abbreviated code below, building our function is relatively freq=' d', straightforward. Unlike in previous versions of Spark, we can declare our functions include.history-Trve","Chunk 396: In this tutorial, we'll show you how to declare a"
397,"in a fairly streamlined manner, specifying the type of pandas object we expect to receive and return, ie., Python type hints. # make predictions results_pd = model.predict (future_pd) Within the function definition, we instantiate our model, configure it and fit it to the","Chunk 397: In this example, we'll be making predictions about the future of pandas."
398,"data it has received. The model makes a prediction, and that data is returned as # return predictions the output of the function. return results_pd databricks",Chunk 398: Returns the result of a function that makes a model of
399,"EBOOK: BIG BOOK OF MACHINE LEARNING USE CASES 2ND EDITION 51 Now, to bring it all together, we use the groupBy command we discussed earlier Next steps to ensure our data set is properly partitioned into groups representing specific","Chunk 399: In our series of letters from African journalists, filmmaker and columnist Farai Sevenzo looks"
400,"store and item combinations. We then simply add the applylnPandas function We have now constructed a forecast for each store-item combination. Using a to our DataFrame, allowing it to fit a model and make predictions on each grouping SQL query, analysts can view the tailored forecasts for each product. In the chart of data. below, we've plotted the projected demand for product #1 across 10 stores. As you",Chunk 400: We've constructed a forecast for each store-item combination.
401,"can see, the demand forecasts vary from store to store, but the general pattern is The data set returned by the application of the function to each group is updated consistent across all of the stores, as we would expect. to reflect the date on which we generated our predictions. This will help us keep track of data generated during different model runs as we eventually take our",Chunk 401: This function returns demand forecasts for each of the following groups of stores:
402,"Mar28,2018 23.0 functionality into production. 35 from Pypark.sgl.functions import current_date results = (",Chunk 402: Pypark.sgl.functions import current
403,"store_item.history 0 groupBy ('store', 'item') Vane DATE",Chunk 403: A selection of photos from around the world from the
404,"Mar01 apply(forecast_store_item) withColumn training.datel, current date ()) As new sales data arrives, we can efficiently generate new forecasts and append these to our existing table structures, allowing analysts to update the business's",Chunk 404: The table below shows sales growth rates over the past five years for the
405,"expectations as conditions evolve. To generate these forecasts in your Databricks environment, please import the following notebook: Fine-Grained Demand Forecasting With Spark 3. To access the prior version of this notebook, built for Spark 2.0, please click this link.",Chunk 405: Forecasts are subject to change at any time.
406,databricks EBOOK: BIG BOOK OF MACHINE LEARNING USE CASES 2ND EDITION 52 CHAPTER 7: Applying Image,Chunk 406: BBC News NI takes a look at some of the
407,Introduction Classification With PyTorch PyTorch Lightning is a great way to simplify your PyTorch code and bootstrap your deep learning workloads. Lightning on Databricks Scaling your workloads to achieve timely results with all the data in your lakehouse brings its own,"Chunk 407: In this course, you will learn how to use PyTorch Lightning and Databricks to"
408,"challenges, however. This article will explain how this can be achieved and how to efficiently scale your code with Horovod. Increasingly, companies are turning to deep learning in order to accelerate their advanced machine learning applications. For example, computer vision techniques are used nowadays to improve defect inspection for manufacturing: natural language processing is utilized to augment business processes with chatbots and","Chunk 408: With Horovod, you can build deep learning applications on top of your existing Python code."
409,"neural network based recommender systems are used to improve customer outcomes. Training deep learning models, even with well-optimized code, is a slow process, which limits the ability of data science teams to quickly iterate through experiments and deliver results. As such, it is important to know how to best harness compute capacity in order to scale this up. In this article we will illustrate how to first structure your codebase for maximum code reuse, then show how",Chunk 409: Deep learning is one of the fastest growing areas of computer science.
