Chunk Number,Original Text Chunk,Summary
1,"HAL open science Combining Internal- and Extemal-Tainimglond: to Predict Non-Contact Injuries in Soccer Emmanuel Vallance, Nicolas Sutton-Charani, Abdelhak Imoussaten, Jacky","Chunk 1: Emmanuel Vallance, Nicolas Sutton-Charani,"
2,"Montmain, Stéphane Perrey > To cite this version: Emmanuel Vallance, Nicolas Sutton-Charani, Abdelhak Imoussaten, Jacky Montmain, Stéphane Per- rey. Combining Internal- and Extemal-Tmaininglonds to Predict Non-Contact Injuries in Soccer. Applied Sciences, 2020, 10 (15), pp.5261. 103390/app10156261. hal-02913576",Chunk 2: A new study suggests that a combination of internal and external factors can predict non-
3,"HAL Id: hal-02913576 https//Imt-mines-altes.halsciemce/hal-02913576v1 Submitted on 10 Aug 2020 HAL is a multi-disciplinary open access L'archive ouverte pluridisciplinaire HAL, est",Chunk 3: The archive of the French Academy of Sciences (HAL
4,"archive for the deposit and dissemination of sci- destinée au dépôt et à la diffusion de documents entific research documents, whether they are pub- scientifiques de niveau recherche, publiés ou non, lished or not. The documents may come from émanant des établissements d'enseignement et de teaching and research institutions in France or recherche français ou étrangers, des laboratoires abroad, or from public or private research centers. publics ou privés.","Chunk 4: The aim of this project is to make available to the public in France and abroad all the research documents entificed in the fields of science, technology, engineering"
5,FIFF applied MDPI sciences Article Combining Internal- and Extema-Training-loads to,Chunk 5: The International Food and Agriculture Organization (FAO) has
6,"Predict Non-Contact Injuries in Soccer Emmanuel Vallance 1,20, Nicolas Sutton-Charani 100, Abdelhak Imoussaten 10, Jacky Montmain 10 and Stéphane Perrey 1,* 1 EuroMov Digital Health in Motion, Univ Montpellier, IMTI Mines Ales, 340901 Montpellier, France; emmanuelvallanceaumontpelier.f: (E.V.); nicolassulton-charani@mines-alesf: (N.S.-C.);","Chunk 6: Predicting Non-Contact Injuries in Soccer Emmanuel Vallance, Nicolas Sutton-Charani"
7,"abdelhakimousaten@mines-alesf: (A.I.); dymommanéninesalstr (.M.) 2 Valenciennes Football Club, 59300 Valenciennes, France Correspondence: Pmepenymompler check for Received: 26 June 2020; Accepted: 27 July 2020; Published: 30 July 2020",Chunk 7: The board of directors of French Ligue 1 club Valen
8,updates Abstract: The large amount of features recorded from GPS and inertial sensors (external load) and well-being questionnaires (internal load) can be used together in a multi-dimensional non-linear machine learning based model for a better prediction of non-contact injuries. In this study we put forward the main hypothesis that the use of such models would be able to inform better about injury,Chunk 8: The aim of this study is to develop a machine learning based model for predicting non-contact injuries in sport.
9,"risks by considering the evolution of1 both internal and external loads over two horizons (one week and one month). Predictive models were trained with data collected by both GPS and subjective questionnaires and injury data from 40 elite male soccer players over one season. Various classification machine-learning algorithms that performed best on external and internal loads features were compared using standard performance metrics such as accuracy, precision, recall and the area under",Chunk 9: The aim of this study was to develop machine-learning algorithms that could predict football-related injuries.
10,"the receiver operator characteristic curve. In particular, tree-based algorithms based on non-linear models with an important interpretation aspect were privileged as they can help to understand internal and external load features impact on injury risk. For 1-week injury prediction, internal load features data were more accurate than external load features while for 1-month injury prediction, thel best performances of classifiers were reached by combining internal and external load features.","Chunk 10: In this study, classifiers based on internal and external load features have been used to predict football injuries."
11,"Keywords: injury prediction; training load monitoring; non-linear machine learning; well-being questionnaires; one-month and one-week time horizons; sport science 1. Introduction Injuries are commonplace in professional soccer. According to a recent study [1), the overall incidence of injuries in elite male soccer players ranges from 2.5 to 9.4 injuries per 1000 h of exposure.",Chunk 11: Injury prediction and well-being in professional soccer.
12,"These authors also showed that the risk of injury is higher during matches than training sessions. One of the last epidemiological studies highlighting the increase of injuries over the past 16 years, has emphasized that muscle incidents were the main cause [2]. Injuries being ubiquitous in this type of complex sport [3] there are several risk factors such as the number of played matches, the accumulation of fatigue induced by the workload during and following training sessions, etc.","Chunk 12: The risk of injury in football is higher than in other sports, according to a study published in the British Journal of Sports Medicine."
13,"Within this context, non-contact injuries are often regarded as preventable and linked to internal and external risk factors related to workload [4). It is therefore essential to quantify properly, over time, the training and competitive match workloads for any injury prediction approach in soccer. In addition, the total training load tends to increase along with the annual performance objectives. Therefore, monitoring the internal load experienced by thej player as the combination of the","Chunk 13: Non-contact injuries are the leading cause of long-term absenteeism in professional football [1,2]."
14,"physiological (heart rate measurements [5]) and psychological (perception questionnaires [6]) stresses and the external load (i.e., the mechanical work completed by the player) during both training and Appl. Sci. 2020, 10, 5261; dol103390/app1015261 wmdplam/pumiypid Appl. Sci. 2020, 10, 5261",Chunk 14: The purpose of this study is to investigate the effects of training on the player's
15,2of 20 competition is of fundamental importance to allow the individualization of training activities [7] as well as the identification of potential injury risk at the individual player level. Many studies have already examined soccer activity. Randers et al. [8] indicated that analytical tools such as video and wearable technology like Global Positioning System (GPS) devices and inertial,Chunk 15: The World Cup is one of the most important sporting events in the world.
16,"sensors can provide accurate mechanical data about players activities both during training and in competition. Several important performance-related features have been highlighted, such as distances travelled at different speeds, accelerations, decelerations and maximum speed [9]. For instance, the average distance travelled in matches by elite soccer players is of 9 to 12 km [9,10]. Sprinting in particular is often considered as a major component of performance, but ultimately it only represents","Chunk 16: In our series of letters from African journalists, film-maker and columnist Ahmedou Ould-Abdallah looks at the role of sensors in sports performance."
17,"10% of the total distance covered during matches [11]. These various metrics among others (e.g., acceleration and deceleration ranges, changes of direction) are regularly used to quantify external load. Both high and low external loads lead to injury risk, with suggestions that there may be an optimum load threshold for individuals [12]. Besides objective physical tests, it is also possible to use subjective measures to predict injury risk. The session Rating of Perceived Exertion (RPE) has been","Chunk 17: The distance covered by a player during a football match is an important measure of the external load on his or her body, i.e."
18,"used for injury risk estimation [13-15). Indeed, recent research in elite soccer recording contact and non-contact injuries has identified a link between internal workload (using session RPE) and injury incidence [16] while no relationship between internal load and non-contact injuries was observed in other studies [14]. The large amount of features recorded from the assessment of external load (GPS and inertial",Chunk 18: The use of recorders to assess the external load on a player's body has become increasingly popular in recent years.
19,"sensors) and internal load (associated with subjective well-being questionnaires and RPE) can be used together in order to better capture the relationship between both internal and external loads [17] and predict in turn players injury. However, the more massive collected data, the more complex their managing. It is now acknowledged that machine learning methods applied to sport can provide accurate diagnostic and decision tools for training management and injury risk assessment but are not","Chunk 19: Sport has a long history of collecting vast amounts of data about its players, both on and off the field."
20,"yet widely used in the latest scientific studies (see for a review Claudino et al. [18]). One of the first investigations that tried to predict non-contact: injuries in team-sports using machine-learning methods was conducted by Rossi et al. [19]. Starting from the observation thati injury risk assessment by applying the so-called açute:chronic workload ratio (e.g., used in Raya-Gonzaled et al. [14]) led to inaccurate and poor prediction abilities, Rossi et al. [19] proposed a multi-dimensional approach to injury prediction",Chunk 20: Injuries in team-sports are one of the most common sports-related injuries in the world.
21,"in professional soccer based on external load data collected through GPS measurements. For that purpose, they trained decision trees that predict whether or not a player is likely to get injured in the next match or training session. Such non-linear models applied only to external training load showed better performance: metrics than traditional statistical methods for predicting injury risk [19]. However these performances are far from being optimal for the prediction of injuries, i.e., 50% of","Chunk 21: In this paper, we present a novel method for predicting player injuries."
22,"precision and 80% of recall. Altogether, it appears that, to our knowledge, the scientific literature remains very scarce on the problem of injury prediction in elite soccer from internal and external loads together in a multi-dimensional non-linear machine learning based model. Therefore, given the amount of data collected in modern elite soccer regarding both external and internal loads, it's nowadays relevant to apply machine-learning methods to a pre-established set of","Chunk 22: In this paper, we present a novel machine-learning based model for injury prediction in elite soccer."
23,"variables in order to provide useful information for professional coaching. We put forward the main hypothesis that using such type machine-learning methods would be able to inform us with good prediction performance. about injury risks over two. horizons (one week and one month) by considering the combined evolution of both internal and external training loads. The results of the present study, as being the first one coupling the two types of training loads, could guide the programming and",Chunk 23: The aim of the present study is to develop a machine-learning method to predict the risk of injury in football players.
24,"individualization of physical training with the aim of controlling and thus reducing the risk of injury. The evaluation of the proposed approach in this study is done in two steps. First, combining external and internal loads features is proposed to predict injuries with better performances as compared to past studies using only external load. Second, some classification algorithms that perform best on these features are selected. For this aim, various standard machine learning algorithms are compared using",Chunk 24: The aim of this study is to develop a machine learning approach for predicting injuries during physical training.
25,"standard evaluation metrics such as accuracy, precision, recall and the area under the receiver operator Appl. Sci. 2020, 10, 5261 3of 20 characteristic curve (AUC). In particular, tree-based algorithms with an important interpretation aspect are privileged as they can help to identify and understand how GPS and questionnaires variables",Chunk 25: The aim of this paper is to develop a tree-based algorithm for the estimation of the accuracy of global positioning
26,"impact on injury risk. 2. Materials and Methods 2.1. Procedures and Data Collection Forty players (mean t SD; age 29.4 t 5.8 years; height 175.3 t 5.2 cm; body mass 76.5 t 8.21 kg) classified from all offensive and defensive position groups (9 central defenders, 8 fullbacks, 10 central",Chunk 26: The purpose of this study is to: 1.
27,"midfielders, 6 wide midfielders, 7 forwards) from the same elite soccer club competing in the French Ligue 2 participated in one: full-season (2017/2018) data collection. The study was conducted according to the requirements of the Declaration of Helsinki. Participants gave their written informed consent to participate in the study. Approval for the study was obtained from the Club as player's data were routinely collected throughout the season.",Chunk 27: The Finnish Football Association (FFA) has carried out a study on the relationship between the number of players from the same club competing in the French Ligue 2
28,"The training workload, perceptive well-being questionnaires and injury data were monitored over the pre-season period and during the entire competitive period from June 2017 to May 2018, taking into account the different breaks between these periods, the international truces and the winter truce. A total of 245 training sessions, 38 Domino's Ligue 2 matches, 2 Coupe de la Ligue matches and 3 Coupe de France matches were recorded and analyzed. Altogether, the average recording time in",Chunk 28: This study was carried out by the French Football Federation (FIF) and the French Institute of Sport (IOM).
29,"training and match was 68 t 24 min and 105 t 11 min, respectively. The average distance covered by all players for both training session and match was 4817 t 1965 m and 7694 t 1527 m, respectively; and the average duration was 65 t 13 min per training session and 78 t 16 min per match. During those periods, 142 injuries were inferred from the training notes containing the list of injured players for each training session. The injuries concerned 33 different players. Figure 1",Chunk 29: The following table shows the number of injuries sustained by players during training sessions and matches of the National Football League (NFL) between 1999 and 2003.
30,"represents the number of injuries per players: 12 players were injured only once, 5 players were injured 6 times and 1 player had 12 injuries. It is important to note that the real injury times and reasons were not known. It was alleged that when a player was referred as injured in a training session, it was in fact at the last training session that his injury really occurred. The injury labels contain therefore some uncertainty that was not taken into account in this study.",Chunk 30: This table shows the number of players who were injured during training sessions in the past five years.
31,12- 10 8- 6 # 4,"Chunk 31: Match reports from the French Open, where world number"
32,"2- l., 0 2 3 4 5 6 7 8 9 10 11 12 # injuries",Chunk 32: Watch highlights of England's Euro 2016 win over
33,"Figure 1. Number of injuries per players. Various types of training load features (see Table 1) regarding a professional soccer club were collected from 40 players during official competitive: matches, pre-season preparation matches, before, during and after training sessions. A first set of features concerned the player's activity using a GPS tracking system. The GPS system allows real-time player tracking and an early a posteriori analysis",Chunk 33: The aim of this study was to investigate the impact of training load on player injury rates.
34,"for coaching staff. This first set of features reflects the external training load, i.e., the objective physical work performed by the player. The player's physical activity during each training session and match Appl. Sci. 2020, 10, 5261 4of20 was measured using a portable 10 Hz GPS system (Optimeye $5, Catapult Innovations, Melbourne,","Chunk 34: The aim of this study is to develop a system to monitor player performance, i.e."
35,"Australia) integrated with a 100 Hz triaxial accelerometer and a gyroscope. The accelerometer and gyroscope components combined with 10 Hz GPS systems have shown acceptable levels of reliability and validity in team sports for distance and high-speed distance-based metrics [20,21]. Four main external load features were measured: maximum speed, total distance covered, and number of accelerations and decelerations. Based on the dedicated literature [22,23] the following external",Chunk 35: A high-performance inertial measurement unit (IMU) has been developed for use in team sports (e.g.
36,"training load features were retained: the total distance travelled in each specific speed zone (0-1 km/h, 0-6 km/h, 6-15 km/h, 15-20 km/h, 20-25km/h, > 25 km/h) and the PlayerLoad TM (athlete's mechanical fatigue index according to Barrett, Midgley, and Lovell [24]), which is a modified vector magnitude expressed as the square root of the sum of the squared instantaneous rated of change in acceleration in each of the three planes and divided by 100.","Chunk 36: A new version of the athlete's fatigue rating system, the Fatigue Rating System (FRS), has been developed."
37,"Table 1. Set of features used in the study. GPS is corresponding to features of external loads while questionnaires (based on a 10 cm visual analog scale, VAS10) are dealing with internal loads. Type of Data Name Definition",Chunk 37: The following table lists the features used in the study.
38,age age at thel beginning of the 2017 season weight weight at the beginning of the 2017 season personnal features,Chunk 38: BBC Sport tracks the weight of the world's
39,height height at thel beginning of the 2017 season BMI Body Mass Index role,Chunk 39: BBC Sport takes a look back at some of the
40,role tot_dur total duration tot_dist total distance covered,Chunk 40: BBC Sport takes a look at some of the key
41,tot_PL total Player Load vel_B1 distance covered between 0 and 1 km/h vel_B2,Chunk 41: Match reports and team news for the weekend's
42,distance covered between 0 and 61 km/h vel_B3 distance covered between 6 and 15 km/h GPS vel_B4,"Chunk 42: All photographs courtesy of AFP, EPA, Getty Images"
43,distance covered between 15 and 20 km/h vel_B5 distance covered between 20 and 25 km/h vel_B6 distance covered at more than 25 km/h,Chunk 43: BBC News takes a look at some of the key
44,acc_B2 number of accelerations above 2 m/s? acc_B3 number of decelerations above 2m/s2 max_vel,Chunk 44: acc_B1 number of accelerations above 2
45,maximum: speed in m/s sleep-qual (VAS10) sleep quality fatigue (VAS10) fatigue state of the player,Chunk 45: Preview and team news for Saturday's Premier League
46,shape (VAS10) being in good shape pre-session questionnaire mood (VAS10) actual mood of the player pain (yes or no),Chunk 46: Match reports and team news for Saturday's Premier
47,"perceived pain inj.worry (if pain, VAS10) worry in relation to pain ill sick or not RPE (VAS10)",Chunk 47: Fear of pain (VAS10) fear of pain ill
48,rating of perceived exertion of the session post-session questionnaire satisfaction (VAS10) satisfaction during his performance pleasure (VAS10) pleasure during the session,"Chunk 48: BBC Sport's Sport Personality of the Year,"
49,"2.2. Predicting Injuries This section presents our approach to predict injuries based on a dataset containing both external load and internal load features. As external load features (GPS) have already shown good results for injury prediction in soccer [19], this study aims to unveil the predictive power of internal load features (questionnaires) relatively to external load ones. Several classifiers were optimised and compared in",Chunk 49: We have developed a novel approach to predict injuries based on a dataset containing both external load and internal load features.
50,"terms of predictive performance. Two prediction perspectives (horizons) were considered in this study: injury at 1 week and injury at 1 month. The models thus constructed can therefore serve as an alert for any new training session for which the model would predict an injury and can be used as an aid to training planning and adjustment. Appl. Sci. 2020, 10, 5261",Chunk 50: The aim of this study was to construct a model to predict the likelihood of an athlete sustaining an injury during a training session.
51,"5of20 Moreover, the models interpretation can provide knowledge for expert in order to have a better understanding of when, how and why injuries happen. 2.3. Data Pre-Processing and Evaluation Protocol Imputation by mean (for numerical variables) and frequency (for categorical variables) was",Chunk 51: The aim of this study was to develop a model that could be used to estimate the risk of
52,"performed upstream the model comparison was made. Categorical variables were transformed into binary dummy ones in order to be handled by all models. Once the dataset was built, all models hyper-parameters were tuned using a Bayesian optimisation procedure (python package scikit-optimise) according to the different evaluation metrics. Since this step was done for models tuning upstream some comparisons between models behaviors and features",Chunk 52: In this paper we have built and tuned a set of hierarchical hierarchical models using python.
53,"sets and not for strict model selection with the aim of being directly used for some new unlabelled data, bayesian optimisation was performed before the main experiments and not included inside our evaluation protocol. The values of the tuned hyper-parameters are given in Appendix A (see Tables A1 and A2). Finally, the models were evaluated by 10-fold cross-validations using 4 measures of predictive",Chunk 53: hyper-parameters were tuned for the following reasons:
54,performance (see Table 2) according to the two predictive horizons previously mentioned (1 week and 1-month). This process was repeated 10 times to check the stability of the model's performances. Table 2. Binary measures of predictive performance. TP+TN How many examples,Chunk 54: The following measures of predictive performance have been used to check the stability of a model for predicting
55,accuracy TPFPTNFN we correctly predicted How many of those precision TFP,Chunk 55: BBC Sport takes a look back at some of the
56,"predicted injury are actually injury recall TEN Of all injury examples, how many of those we correctly predicted",Chunk 56: BBC Sport takes a look back at some of the
57,"Area Under the ROC Curve (AUC) ROC =1 rate (TP/FP) 2.4. Predictive Models The learning models considered in this study are the following: K-Nearest Neighbours (KNN) Linear Discriminant Analysis (LDA)[25,26).",Chunk 57: The following table presents the results of this study:
58,"Logistic regression (logit) Ridge classifier (Ridge) Gaussian Naive Bayes classifier (GNB) [27,28]. Classification tree (tree) [29]. Random forest (forest) [30].",Chunk 58: This paper presents the results of a logistic regression study
59,Support Vector Machine (SVM) [31). Multi-Layer Perceptron (MLP) [32-34]. eXtreme Gradient Boosting (XGB) KNN classifiers are very simple to compute but have the main drawbacks of involving high computation times for large data-sets and to be hard to interpret since in distances computation,"Chunk 59: In this paper, we present a new class of classifiers, called KNN, which can"
60,"between examples, no explicit feature selection or weighting can be directly computed. Classification trees are basic classifiers which can be used in non-linear contexts. They are often used for their graphical outputs which are easily interpretable and provide visualisation of multi-dimensional features impact on class variables. In our context, such tools could help experts to gain knowledge about the relation between training loads and injury risk. They were compared to different generalised",Chunk 60: In this paper we present a classification tree tool which can be used to investigate the relationship between training loads and injury risk.
61,"linear classifiers which are usually categorized as generative or discriminative: models [35]. Naive Bayes classifier and LDA were used as standard generative models, logit, Ridge, MLP and SVM as Appl. Sci. 2020, 10, 5261 6of 20 discriminative ones. In Rossi et al. [19], the authors found that classification tree had higher predictive","Chunk 61: In this study, 20 classifiers which are usually classified as generative or discriminative were used."
62,"performance than other models (including random forest), but since ensemble models are usually more accurate than simple trees, forest and XGB: models were also included in this study. Moreover, all tree-based classifiers (tree, forest and XGB) provide features weights which are precious in terms of models interpretation. Different sets of attributes (see Table 3) were considered in order to highlight the potential",Chunk 62: The potential of tree-based classifiers has been considered in this study.
